name,main_category,sub_category,image,link,ratings,no_of_ratings,discount_price,actual_price
"MS Pet House Munchy Chew Sticks Chicken Flavor 1.8 Kg, Munchies for All Breed Dogs, Adult Dog Snacks.",pet supplies,Dog supplies,https://m.media-amazon.com/images/I/71A6WiPQzPL._AC_UL320_.jpg,https://www.amazon.in/MS-Munchy-Chicken-Munchies-Snacks/dp/B0BR85SQX4/ref=sr_1_6422?qid=1679214879&s=pet-supplies&sr=1-6422,4.2,227,₹425,"₹1,600"
"Pets Empire Cat Puppy Playpen Cage Crate - Portable Folding Exercise Kennel - Indoor & Outdoor use Size XS (26"" x 17"") Col...",pet supplies,Dog supplies,https://m.media-amazon.com/images/I/61UpXjDfTLL._AC_UL320_.jpg,https://www.amazon.in/Pets-Empire-Portable-Folding-Exercise/dp/B07Q3WSN11/ref=sr_1_6423?qid=1679214879&s=pet-supplies&sr=1-6423,3.6,23,"₹1,514","₹1,999"
Trixie Dog Toy Ball with Sound,pet supplies,Dog supplies,https://m.media-amazon.com/images/I/71kZkdqvfpS._AC_UL320_.jpg,https://www.amazon.in/Trixie-Natural-Rubber-Ball-Sound/dp/B00121XPR6/ref=sr_1_6424_mod_primary_new?qid=1679214879&s=pet-supplies&sbo=RZvfv%2F%2FHxDF%2BO5021pAnSA%3D%3D&sr=1-6424,4.2,544,₹523,₹550
Trixie Pads for Protective Pants for Dogs,pet supplies,Dog supplies,https://m.media-amazon.com/images/I/71MW-v8xAXL._AC_UL320_.jpg,https://www.amazon.in/Trixie-Pads-Protective-Pants-10pcs/dp/B07M9VL7X2/ref=sr_1_6425?qid=1679214879&s=pet-supplies&sr=1-6425,4.2,9,₹342,₹360
Pet & Parents Dino Star Padded Harness with Leash |Chest Harness|No Choke| Soft Padded Harness|Neck and Chest Adjustable|W...,pet supplies,Dog supplies,https://m.media-amazon.com/images/I/61p2A6IO5bL._AC_UL320_.jpg,https://www.amazon.in/Pet-Parents-Harness-Adjustable-Washable/dp/B0BN6WV1N1/ref=sr_1_6426?qid=1679214879&s=pet-supplies&sr=1-6426,,,"₹1,259","₹1,399"
Pets Empire Dog Toys Rubber Bones Puppy Chew Toy Dog Toothbrushing Stick Durable Natural Rubber for Dog Dental Care Puppy ...,pet supplies,Dog supplies,https://m.media-amazon.com/images/I/61hok7B7lgL._AC_UL320_.jpg,https://www.amazon.in/Empire-Toothbrushing-Durable-Natural-Cleaning-1/dp/B09V35Y876/ref=sr_1_6427?qid=1679214879&s=pet-supplies&sr=1-6427,,,₹124.53,₹399
RvPaws Metal Bone Shaped Collar Tag Pendant for Pet - Colour May Vary,pet supplies,Dog supplies,https://m.media-amazon.com/images/I/61KL1oM44WL._AC_UL320_.jpg,https://www.amazon.in/RvPaws-Metal-Shaped-Collar-Pendant/dp/B09J28XTKK/ref=sr_1_6428?qid=1679214879&s=pet-supplies&sr=1-6428,4.3,10,₹199,₹709
"Chip Chops Chicken Tenders Slice Dog Treat, Optimum Health Formula, Highly Nutritional & Digestible, Suitable for All Dog ...",pet supplies,Dog supplies,https://m.media-amazon.com/images/I/51ZgzWcgPdL._AC_UL320_.jpg,https://www.amazon.in/Chip-Chops-Chicken-Tenders-Slice/dp/B07GDKDS27/ref=sr_1_6429?qid=1679214879&s=pet-supplies&sr=1-6429,4.6,35,,₹420
ROMSAY Dandruff & Conditioning Mint Shampoo 200ML Pack Of 2 With Pet Bathing Brush | Dandruff Free | Allergy Relief | Dog ...,pet supplies,Dog supplies,https://m.media-amazon.com/images/I/41YNZpAjmtL._AC_UL320_.jpg,https://www.amazon.in/ROMSAY-Mint-Shampoo-Pack-Brush/dp/B0BN39CGW1/ref=sr_1_6430?qid=1679214879&s=pet-supplies&sr=1-6430,,,₹288,₹698
"Goodies Dog Energy Treats Spiral Twist Stick Chicken BBQ & Lamb Flavor 98% Healthy Snack & Training Treat, Best for Dog (1...",pet supplies,Dog supplies,https://m.media-amazon.com/images/I/815soybU3UL._AC_UL320_.jpg,https://www.amazon.in/Goodies-Chicken-Healthy-Training-Launched/dp/B098P4MYNZ/ref=sr_1_6431_mod_primary_new?qid=1679214879&s=pet-supplies&sbo=RZvfv%2F%2FHxDF%2BO5021pAnSA%3D%3D&sr=1-6431,3.9,11,₹585,₹595
Awraaq Hog Ring 1200 Pcs Galvanized M Clips Staples Poultry Pet Mesh Cage Wire Fencing Clips - 18 x 60mm,pet supplies,Dog supplies,https://m.media-amazon.com/images/I/518gH7lcOBL._AC_UL320_.jpg,https://www.amazon.in/Awraaq-Galvanized-Staples-Poultry-Fencing/dp/B09TKP4LMB/ref=sr_1_6432?qid=1679214879&s=pet-supplies&sr=1-6432,4.2,4,₹445,₹799
Super Dog Rope Toy (Large) - Color May Vary,pet supplies,Dog supplies,https://m.media-amazon.com/images/I/518gH7lcOBL._AC_UL320_.jpg,https://www.amazon.in/Super-Dog-Rope-Toy-Large/dp/B0120U2K9Q/ref=sr_1_6601?qid=1679214882&s=pet-supplies&sr=1-6601,4.1,129,₹175,₹299
"QIYADIN Dog Comfort Dog Anxiety Relief Coat, Breathable Thunder Shirts for Dogs, Dog Anxiety Vest Jacket Warp, Puppy Anxie...",pet supplies,Dog supplies,https://m.media-amazon.com/images/I/61VMwqu-kwL._AC_UL320_.jpg,https://www.amazon.in/QIYADIN-Comfort-Anxiety-Breathable-Thunder/dp/B094FYHVLX/ref=sr_1_6793?qid=1679214886&s=pet-supplies&sr=1-6793,3.9,622,,
"Hiputee Soft Velvet Cat Dog Pet Bed - Reversible | Portable | Washable | for All Breeds (XS, Grey)",pet supplies,Dog supplies,https://m.media-amazon.com/images/I/71CBsoJrNBL._AC_UL320_.jpg,https://www.amazon.in/Hiputee-Soft-Velvet-Cat-Dog/dp/B0BC8H9LCX/ref=sr_1_6794?qid=1679214886&s=pet-supplies&sr=1-6794,3.0,2,₹449,"₹1,498"
Myartbucket Parkar Polka Dress for Small Dog Girl Puppy Clothes Female Princess Tutu Striped Skirt Summer Shirt for Shihtz...,pet supplies,Dog supplies,https://m.media-amazon.com/images/I/714YRSD-AAL._AC_UL320_.jpg,https://www.amazon.in/Myartbucket-Clothes-Princess-Striped-Shihtzu/dp/B0BB6KN4YG/ref=sr_1_6795?qid=1679214886&s=pet-supplies&sr=1-6795,4.6,3,₹799,"₹3,000"
"Dog Trust Easy to Move with Removable Tray Iron Cage Crate Kennel for Dog and Rabbit Black, 18 Inch",pet supplies,Dog supplies,https://m.media-amazon.com/images/I/5165oA7T7TL._AC_UL320_.jpg,https://www.amazon.in/Dog-Trust-Removable-Kennel-Rabbit/dp/B09LMKGZWV/ref=sr_1_6796?qid=1679214886&s=pet-supplies&sr=1-6796,4.0,1,"₹1,039","₹1,049"
Ruse Pet Good Girl Jersey No.1 Printed Round Neck Sleeveless Dog Vest Tank T-Shirt/Tees Apparel/Clothes/Tees Gift for Dog...,pet supplies,Dog supplies,https://m.media-amazon.com/images/I/71jDi8f12EL._AC_UL320_.jpg,https://www.amazon.in/Ruse-Printed-Sleeveless-T-Shirt-Apparel/dp/B09DTCDKT6/ref=sr_1_6797?qid=1679214886&s=pet-supplies&sr=1-6797,3.9,74,₹549,"₹1,099"
"Dogaholic Calcium Biscuit Dog Treat, Vegetarian Treat, Natural Ingredients, Freshen Breath, Healthy Easy to Digest Dog Tre...",pet supplies,Dog supplies,https://m.media-amazon.com/images/I/61A0Z-+AEhL._AC_UL320_.jpg,https://www.amazon.in/Dogaholic-Calcium-Biscuit-Treat-Each/dp/B07QS37Z51/ref=sr_1_6798?qid=1679214886&s=pet-supplies&sr=1-6798,3.6,6,,₹525
"BLACK DOG Dog Grooming Foot/Paw Washing Cup, Pet Paw Cleaner, Portable Dog Washer with Feet Soft Silicone Bristles Small M...",pet supplies,Dog supplies,https://m.media-amazon.com/images/I/51nddokBnML._AC_UL320_.jpg,https://www.amazon.in/BLACK-DOG-Grooming-Portable-Small-Color/dp/B07YRSHQ7W/ref=sr_1_6799?qid=1679214886&s=pet-supplies&sr=1-6799,3.7,134,₹347,₹778
"Simple Solution Disposable Diapers, Small (12 Pack)",pet supplies,Dog supplies,https://m.media-amazon.com/images/I/61B28rltSTL._AC_UL320_.jpg,https://www.amazon.in/Simple-Solution-Disposable-Diapers-Small/dp/B000BHHD98/ref=sr_1_6800?qid=1679214886&s=pet-supplies&sr=1-6800,3.9,"2,297",₹895,₹995
VVWV® Blue Water Aquirium Background Stickers for Fish Tank Waterproof Vinyl Printed Sticker Multicolored (91 X 41 CMS),pet supplies,Dog supplies,https://m.media-amazon.com/images/I/61Wy7A2u7XL._AC_UL320_.jpg,https://www.amazon.in/Aquirium-Background-Stickers-Waterproof-Multicolored/dp/B0BW492S33/ref=sr_1_6801?qid=1679214886&s=pet-supplies&sr=1-6801,,,₹499,₹699
Heads Up For Tails Donkey The Gentleman Cuddle Dog Toy Cute and Soft Support Toy,pet supplies,Dog supplies,https://m.media-amazon.com/images/I/51VAcdwOdRL._AC_UL320_.jpg,https://www.amazon.in/Heads-Up-Tails-Gentleman-Support/dp/B0BS67664L/ref=sr_1_6802?qid=1679214886&s=pet-supplies&sr=1-6802,Get,FREE Delivery by Amazon,,₹699
saway Export Quality Calcium Sticks 250g,pet supplies,Dog supplies,https://m.media-amazon.com/images/I/51q9pJQD-mL._AC_UL320_.jpg,https://www.amazon.in/saway-Export-Quality-Calcium-Sticks/dp/B0B9NBMF53/ref=sr_1_6803?qid=1679214886&s=pet-supplies&sr=1-6803,,,₹189,₹299
Wrixty 2 in 1 Pet & Cat Hair Grooming Dryer Self Cleaning Slicker Brush Comb Professional Pet Blow Dryer Adjustable Heatin...,pet supplies,Dog supplies,https://m.media-amazon.com/images/I/61Vu41c5UQL._AC_UL320_.jpg,https://www.amazon.in/Wrixty-Cat-Hair-Brush-Comb-Professional-Dryer-Adjustable-Heating-Temperature-Settings/dp/B0B2MVRVWG/ref=sr_1_6804?qid=1679214886&s=pet-supplies&sr=1-6804,5.0,4,₹699,"₹1,599"
Evascab Anti-itching Fresh Dog Shampoo (400 ml) (Set of 2),pet supplies,Dog supplies,https://m.media-amazon.com/images/I/41atUPDTWeL._AC_UL320_.jpg,https://www.amazon.in/Evascab-Anti-itching-Fresh-Dog-Shampoo/dp/B09G9SYRMV/ref=sr_1_6805?qid=1679214886&s=pet-supplies&sr=1-6805,,,₹450,₹500
Chip Chops Lamb Cubes Dog Treat 70g (Pack of 4),pet supplies,Dog supplies,https://m.media-amazon.com/images/I/41fEq8dA5GL._AC_UL320_.jpg,https://www.amazon.in/Chip-Chops-Lamb-Cubes-Treat/dp/B0BXD8M8DG/ref=sr_1_6806?qid=1679214886&s=pet-supplies&sr=1-6806,,,₹748,₹840
"AIK INDIA Army Dog Collar Neck Belt for Puppy Small Medium Large Dogs,Military Dog Belt (Large-1.25 inch,Camouflage)",pet supplies,Dog supplies,https://m.media-amazon.com/images/I/71Wedy-KqFL._AC_UL320_.jpg,https://www.amazon.in/AIK-Collar-Military-Large-1-25-Camouflage/dp/B0B6SR4GDJ/ref=sr_1_6807?qid=1679214886&s=pet-supplies&sr=1-6807,4.2,8,₹229,₹399
Quickato Red Belt/Puppy Collar Belt Dog Collar & Leash Steel Chain Dog Collar & Chain,pet supplies,Dog supplies,https://m.media-amazon.com/images/I/41jF1lQWaQL._AC_UL320_.jpg,https://www.amazon.in/Quickato-Puppy-Collar-Leash-Steel/dp/B09XMRSC5P/ref=sr_1_6808?qid=1679214886&s=pet-supplies&sr=1-6808,2.6,2,₹299,₹599
EDELRID Moe III Climbing Harness,pet supplies,Dog supplies,https://m.media-amazon.com/images/I/61D9LONX2QL._AC_UL320_.jpg,https://www.amazon.in/EDELRID-Moe-III-Climbing-Harness/dp/B08VSJLM86/ref=sr_1_6809?qid=1679214886&s=pet-supplies&sr=1-6809,4.7,16,"₹4,635","₹5,150"
"KittuPet Dog Rope Toys Dog Toys for Medium Dogs and Small Dogs, Clean Teeth, Tug of War - Tough Dog Toys, Dog's Best Gift,...",pet supplies,Dog supplies,https://m.media-amazon.com/images/I/51p3J5CbueL._AC_UL320_.jpg,https://www.amazon.in/KittuPet-Medium-Small-Clean-Teeth/dp/B0BXKRMZG4/ref=sr_1_6810?qid=1679214886&s=pet-supplies&sr=1-6810,,,₹499,₹999
Woofy Heavy Duty Solid Pure Brass Swivel Bolt Snap Hook Single Ended Round Swivel Clip Buckle Dog Chain Leather Craft Scub...,pet supplies,Dog supplies,https://m.media-amazon.com/images/I/41G6YEEV9IL._AC_UL320_.jpg,https://www.amazon.in/Woofy-Swivel-Leather-Snorkeling-Equipment/dp/B0BPR2VVCZ/ref=sr_1_6811?qid=1679214886&s=pet-supplies&sr=1-6811,,,₹249,₹699
DOGTOWN Eetoys Dog Latex Squeaky Rugby Ball Toy (Large),pet supplies,Dog supplies,https://m.media-amazon.com/images/I/61rpYSwGU1L._AC_UL320_.jpg,https://www.amazon.in/DOGTOWN-Eetoys-Latex-Squeaky-Rugby/dp/B09873TD27/ref=sr_1_6812?qid=1679214886&s=pet-supplies&sr=1-6812,4.0,40,₹549,₹599
Fidele+ Dry Dog Food Adult Large Breed Chicken with Natural Ingredients | No Soy | No Wheat | (1-7 Years Dog) 3 Kg+500g Fr...,pet supplies,Dog supplies,https://m.media-amazon.com/images/I/51ohcuJ-lLL._AC_UL320_.jpg,https://www.amazon.in/Fidele-Chicken-Natural-Ingredients-Inside/dp/B0BSLDZBYK/ref=sr_1_6813_mod_primary_new?qid=1679214886&s=pet-supplies&sbo=RZvfv%2F%2FHxDF%2BO5021pAnSA%3D%3D&sr=1-6813,Get,Only 1 left in stock.,"₹1,599","₹1,600"
basil Puppy Non-Veg Biscuits Bone Shape (900g),pet supplies,Dog supplies,https://m.media-amazon.com/images/I/71-K-ycJAdS._AC_UL320_.jpg,https://www.amazon.in/House-Gifts-Non-Veg-Biscuits-Keychain/dp/B08FMQ1F97/ref=sr_1_6814?qid=1679214886&s=pet-supplies&sr=1-6814,3.7,8,₹312,₹450
"RvPaws Dog Cage - Blue Color Powder Coated, Double Door Folding Metal Cage/Crate/Kennel with Removable Tray and Paw Protec...",pet supplies,Dog supplies,https://m.media-amazon.com/images/I/51-7RNw8AbL._AC_UL320_.jpg,https://www.amazon.in/RvPaws-36-inch-Metal-Cage-Large/dp/B07XWL61NT/ref=sr_1_6815?qid=1679214886&s=pet-supplies&sr=1-6815,4.2,60,"₹3,599","₹4,999"
Bestie Dog Cage Power Coated Gold Rust Proof Metal Folding for Medium Size Dogs and Adults 30 Inch (2.5 Feet) LENGTH-76 C...,pet supplies,Dog supplies,https://m.media-amazon.com/images/I/91i3Ydw3iPL._AC_UL320_.jpg,https://www.amazon.in/Bestie-Foldable-Kennel-Removable-Protection/dp/B09VDQ3P2R/ref=sr_1_6816?qid=1679214886&s=pet-supplies&sr=1-6816,4.1,39,"₹3,099","₹6,999"
Myartbucket Wedding and Festive Dog Tuxedo Black Bandana with Bow | Pet Tuxedo Bandana (Medium),pet supplies,Dog supplies,https://m.media-amazon.com/images/I/719i3yogkPL._AC_UL320_.jpg,https://www.amazon.in/Myartbucket-Wedding-Festive-Tuxedo-Bandana/dp/B08PT54F3D/ref=sr_1_7009?qid=1679214890&s=pet-supplies&sr=1-7009,4.0,37,₹499,"₹1,000"
"Kiki N Pooch Disposable Pet Diapers for Dogs (X-Xtra Large, 660mm X 400mm, 12 pcs)",pet supplies,Dog supplies,https://m.media-amazon.com/images/I/411DAATSmZS._AC_UL320_.jpg,https://www.amazon.in/Kiki-Pooch-Disposable-Diapers-X-Xtra/dp/B08JKCBZMC/ref=sr_1_7010?qid=1679214890&s=pet-supplies&sr=1-7010,3.0,25,₹560,"₹1,099"
"Pet Believe Puppies Treat Biscuits Dry Dog Food Starter Mother and Pup for Dogs, Chicken, 1 kg",pet supplies,Dog supplies,https://m.media-amazon.com/images/I/617WnR6tB7L._AC_UL320_.jpg,https://www.amazon.in/Pet-Believe-Puppies-Biscuits-Starter/dp/B086D95LTX/ref=sr_1_7011?qid=1679214890&s=pet-supplies&sr=1-7011,4.0,43,₹249,₹399
Drools Focus Puppy 100g (Pack of 10),pet supplies,Dog supplies,https://m.media-amazon.com/images/I/41yNwy+kzmL._AC_UL320_.jpg,https://www.amazon.in/Drools-focus-puppy-100g-pack/dp/B07872RF8N/ref=sr_1_7012?qid=1679214890&s=pet-supplies&sr=1-7012,3.0,1,₹417,₹700
"The Pets Company Infinity Loop Dog Rope Toy for Chewing Teething, Ball Dog Tug Toys for Small & Medium Dogs",pet supplies,Dog supplies,https://m.media-amazon.com/images/I/71pOT9vDxCL._AC_UL320_.jpg,https://www.amazon.in/Pets-Company-Infinity-Chewing-Teething/dp/B0BQGPVLVT/ref=sr_1_7013?qid=1679214890&s=pet-supplies&sr=1-7013,,,,₹149
Go Pet High Protein Chicken & Mutton Flavored Nutritious 2Kg Munchy Chew Sticks of All Breed & All Life Stages Dog for Den...,pet supplies,Dog supplies,https://m.media-amazon.com/images/I/61tf5yVJquL._AC_UL320_.jpg,https://www.amazon.in/Protein-Chicken-Mutton-Flavored-Nutritious/dp/B09XXWZ8WQ/ref=sr_1_7014?qid=1679214890&s=pet-supplies&sr=1-7014,3.8,11,₹442,₹599
Petzlifeworld Plastic Hamster Water Bottle Dispenser Automatic Feeding Device for Hamster Rabbit Dog Small Animals Supplie...,pet supplies,Dog supplies,https://m.media-amazon.com/images/I/61hZmGuMsOL._AC_UL320_.jpg,https://www.amazon.in/Petzlifeworld-Dispenser-Automatic-Supplies-Drinking/dp/B09PZ3VK7K/ref=sr_1_7015?qid=1679214890&s=pet-supplies&sr=1-7015,3.6,25,₹210,₹399
Sky-Ec Immunosky Immune Boosting Syrup for Dogs & Cats 200ML (PC - 67601),pet supplies,Dog supplies,https://m.media-amazon.com/images/I/51t9ItpiC-L._AC_UL320_.jpg,https://www.amazon.in/Sky-Ec-Immunosky-Immune-Boosting-Syrup/dp/B09JSJW8BW/ref=sr_1_7016?qid=1679214890&s=pet-supplies&sr=1-7016,5.0,2,,₹250
"PSK PET MART 4 in 1 Combo Pack - Basket, Woof, Bone Print and Football Natural Rubber Light Weight Squeaky Ball Toy for Sm...",pet supplies,Dog supplies,https://m.media-amazon.com/images/I/413k44KTPIL._AC_UL320_.jpg,https://www.amazon.in/PSK-PET-MART-Combo-Pack/dp/B0BKP6VYVY/ref=sr_1_7017?qid=1679214890&s=pet-supplies&sr=1-7017,,,₹329,₹799
"Flexi New Classic Automatic Dog Leash Pause and Lock, Retractable Comfortable One Hand Brake System Durable Non-Slip Handl...",pet supplies,Dog supplies,https://m.media-amazon.com/images/I/719OprCB0MS._AC_UL320_.jpg,https://www.amazon.in/Automatic-Retractable-Comfortable-Non-Slip-Training/dp/B0973BM8D6/ref=sr_1_7018?qid=1679214890&s=pet-supplies&sr=1-7018,3.0,2,"₹2,342","₹2,595"
"Home's Good Adjustable Dogs Harness with Reflective Stripes Vest, No Pull & Easy Control Dog Chest Vest Belt for Medium Dogs",pet supplies,Dog supplies,https://m.media-amazon.com/images/I/71XFDIlzkyL._AC_UL320_.jpg,https://www.amazon.in/Homes-Good-Adjustable-Harness-Reflective/dp/B0BWFM4WCM/ref=sr_1_7019?qid=1679214890&s=pet-supplies&sr=1-7019,4.0,1,₹499,"₹1,299"
All4Fur Egg and Cheese Biscuits for Dogs 800 GMS | Ideal for Your Pet | for All Breed | Dry Food |Pack of 2 | Pet Food & A...,pet supplies,Dog supplies,https://m.media-amazon.com/images/I/61ute0D5FWL._AC_UL320_.jpg,https://www.amazon.in/Egg-Cheese-Biscuits-Food-Accessories/dp/B0BN7WWQPC/ref=sr_1_7020?qid=1679214890&s=pet-supplies&sr=1-7020,,,,₹320
Patch & Marshall Dog Leash Indestructible/Chew Proof Leash for Dogs - 5ft - Grip Handle Short Dog Leash- Silver - 1pc (5ft...,pet supplies,Dog supplies,https://m.media-amazon.com/images/I/61CXyxrpJ8L._AC_UL320_.jpg,https://www.amazon.in/Patch-Marshall-Leash-Indestructible-Proof/dp/B0BJZ341KC/ref=sr_1_7021?qid=1679214890&s=pet-supplies&sr=1-7021,4.2,8,₹349,₹999
Slatters be Royal Store Dog Chew Munchy Sticks Chicken Flavor and Dog Chew Munchy Sticks Mutton Flavor for Puppies and Dog...,pet supplies,Dog supplies,https://m.media-amazon.com/images/I/61ClrCCTaHL._AC_UL320_.jpg,https://www.amazon.in/Slatters-Munchy-Sticks-Chicken-Puppies/dp/B09ZK25XGB/ref=sr_1_7022?qid=1679214890&s=pet-supplies&sr=1-7022,3.5,28,₹331,₹999
Chip Chops Dog Treats - Sushi Rolls - 70 g Each - Pack of 2,pet supplies,Dog supplies,https://m.media-amazon.com/images/I/61p5Ao+Nu6L._AC_UL320_.jpg,https://www.amazon.in/Chip-Chops-Dog-Treats-Sushi/dp/B09N7CZ843/ref=sr_1_7023?qid=1679214890&s=pet-supplies&sr=1-7023,4.0,1,₹399,₹420
Douge Couture Dog/Cat Stairs/Ladder3 Steps Ramp Ladder Pink Army Print,pet supplies,Dog supplies,https://m.media-amazon.com/images/I/51ricVn4jDL._AC_UL320_.jpg,https://www.amazon.in/Douge-Couture-Stairs-Ladder3-Ladder/dp/B07P2C15QH/ref=sr_1_7024?qid=1679214890&s=pet-supplies&sr=1-7024,5.0,1,"₹2,499","₹4,999"
Canine Hardware Chuckit Medium Ultra Ball (2.5 - inch),pet supplies,Dog supplies,https://m.media-amazon.com/images/I/715IgBqoiRL._AC_UL320_.jpg,https://www.amazon.in/Canine-Hardware-Chuckit-Medium-Ultra/dp/B005Y16NBK/ref=sr_1_7025?qid=1679214890&s=pet-supplies&sr=1-7025,4.7,"7,462",,₹608
"ZOROPETS Elevated Double Cat Dog Bowls for Food and Water,Tilted Cat Food Bowl with Stand for Cats and Small Dogs,Food Gra...",pet supplies,Dog supplies,https://m.media-amazon.com/images/I/31h7Ab+xZgL._AC_UL320_.jpg,https://www.amazon.in/ZOROPETS-Elevated-Double-Material-Nonslip/dp/B09WTHCLJS/ref=sr_1_7026?qid=1679214890&s=pet-supplies&sr=1-7026,5.0,1,"₹1,299","₹2,499"
"PETS EMPIRE Puppy Squeaky Toys Smile Star, Donuts, Bite Cute Stuffed Toys for Dogs & Cats Cotton Soft Toy for Dog",pet supplies,Dog supplies,https://m.media-amazon.com/images/I/61tt1jkjqQL._AC_UL320_.jpg,https://www.amazon.in/PETS-EMPIRE-Squeaky-Donuts-Stuffed/dp/B0BT7TQLTX/ref=sr_1_7027?qid=1679214890&s=pet-supplies&sr=1-7027,,,₹299,₹699
Goofy Tails Webbed Reflective Soft Breathable Mesh Dog Harness | Choke-Free Dog Belt | Double Padded Vest with Adjustable ...,pet supplies,Dog supplies,https://m.media-amazon.com/images/I/81YWOl0CIHL._AC_UL320_.jpg,https://www.amazon.in/Goofy-Tails-Reflective-Breathable-Choke-Free/dp/B08BXHW1XZ/ref=sr_1_7028?qid=1679214890&s=pet-supplies&sr=1-7028,3.9,68,₹699,"₹1,550"
"Jerhigh Cookie Dog Treat, 70 g (Pack Of 3)",pet supplies,Dog supplies,https://m.media-amazon.com/images/I/91zlal3AUWL._AC_UL320_.jpg,https://www.amazon.in/Jerhigh-Cookie-Dog-Treat-Pack/dp/B00Q8GELJ6/ref=sr_1_7029?qid=1679214890&s=pet-supplies&sr=1-7029,4.5,16,₹500,₹555
Hug n Wag Tearless Puppy Shampoo - 200 ml (Pack of 2),pet supplies,Dog supplies,https://m.media-amazon.com/images/I/810aN9SQLML._AC_UL320_.jpg,https://www.amazon.in/Hug-Wag-Tearless-Puppy-Shampoo/dp/B07TKYL93Q/ref=sr_1_7030?qid=1679214890&s=pet-supplies&sr=1-7030,4.3,52,₹401,₹500
Tunai Super Saver Dog Biscuits | Dog Treats | Dog food | Real Chicken Adult Dog Biscuits Dog Training Treats | 1KG | Extra...,pet supplies,Dog supplies,https://m.media-amazon.com/images/I/61UKOX8bbEL._AC_UL320_.jpg,https://www.amazon.in/Biscuits-Chicken-Training-Controls-Aggressive/dp/B0B4JDQX48/ref=sr_1_7031?qid=1679214890&s=pet-supplies&sr=1-7031,1.0,1,₹399,₹599
Woofy Reflective Cat Collar with Bell Basic Dog Cat Collar Buckle Adjustable Nylon Cat Dog Collar Safe Pets Belt Small Siz...,pet supplies,Dog supplies,https://m.media-amazon.com/images/I/51JU8PAcpRL._AC_UL320_.jpg,https://www.amazon.in/Woofy-Reflective-Collar-Buckle-Adjustable/dp/B09ZTDVR26/ref=sr_1_7032?qid=1679214890&s=pet-supplies&sr=1-7032,2.5,3,₹199,₹699
Heads Up For Tails Essentials Pee Pads for Dogs - Pack of 10,pet supplies,Dog supplies,https://m.media-amazon.com/images/I/51Hi1rblAyL._AC_UL320_.jpg,https://www.amazon.in/Heads-Up-Tails-Essentials-Pads/dp/B09P6RJ7TM/ref=sr_1_7057?qid=1679214892&s=pet-supplies&sr=1-7057,,,₹474,₹499
Safe-O-Kid - 45CM Safety Gate Extension/Barricade Baby Safety Metal Extension,pet supplies,Dog supplies,https://m.media-amazon.com/images/I/410x76xHsiL._AC_UL320_.jpg,https://www.amazon.in/Safe-Kid-Safety-Extension-Barricade/dp/B0937HBDV1/ref=sr_1_7058?qid=1679214892&s=pet-supplies&sr=1-7058,3.5,10,"₹1,329","₹4,399"
Nuage Remedies Immunogut Powder - 100gm by Jolly and Cutie Pets,pet supplies,Dog supplies,https://m.media-amazon.com/images/I/71k9l9NKq-L._AC_UL320_.jpg,https://www.amazon.in/Nuage-Remedies-Immunogut-Powder-100gm/dp/B07Z9D3T5N/ref=sr_1_7059?qid=1679214892&s=pet-supplies&sr=1-7059,4.0,7,,₹240
Pets Empire Best Combo Offer Dry Bath Dog Shampoo Lavender 250ML + Dry Bath Dog Shampoo Strawberry 250ML (Pack of 2).,pet supplies,Dog supplies,https://m.media-amazon.com/images/I/715ImVf7suL._AC_UL320_.jpg,https://www.amazon.in/Pets-Empire-Lavender-Strawberry-Shampoo/dp/B071VLS8XB/ref=sr_1_7060?qid=1679214892&s=pet-supplies&sr=1-7060,3.9,140,₹441,₹530
"Pets Empire Soft Squeaky Dog Ball 3.5”, Latex Squeaky Dog Toys for Medium Dogs and Small 1 Piece (Color May Vary)",pet supplies,Dog supplies,https://m.media-amazon.com/images/I/61kcSHNsmpL._AC_UL320_.jpg,https://www.amazon.in/Pets-Empire-Colourful-American-Football/dp/B06Y53Z3YK/ref=sr_1_7061?qid=1679214892&s=pet-supplies&sr=1-7061,2.9,12,₹199,₹299
ROYALS RORE Dog Bed Soft Washable Reversible Dog Bed for Small | Medium | Large | Extra Large | XL | L | XXL | XXXL | Cats...,pet supplies,Dog supplies,https://m.media-amazon.com/images/I/71i+wD0YQcL._AC_UL320_.jpg,https://www.amazon.in/ROYALS-RORE-Washable-Reversible-Medium/dp/B0BY3L5FJS/ref=sr_1_7062?qid=1679214892&s=pet-supplies&sr=1-7062,,,₹999,"₹2,999"
"Skora Nylon Fur 1-inch Medium Dog Harness, Collar and Leash (Chest Size : 26-30 inch) (Red)",pet supplies,Dog supplies,https://m.media-amazon.com/images/I/71cc0I3EK8L._AC_UL320_.jpg,https://www.amazon.in/Skora-1-inch-Medium-Harness-Collar/dp/B078MM788P/ref=sr_1_7063?qid=1679214892&s=pet-supplies&sr=1-7063,4.0,91,₹378,₹999
"JerHigh Wet Dog Food, Roasted Duck in Gravy, 120 g (Pack of 6)",pet supplies,Dog supplies,https://m.media-amazon.com/images/I/41lepzZiFiL._AC_UL320_.jpg,https://www.amazon.in/JerHigh-Food-Roasted-Duck-Gravy/dp/B06XH2CLND/ref=sr_1_7064?qid=1679214892&s=pet-supplies&sr=1-7064,4.6,8,₹415,₹420
The DDS Store Large Dog Rope Toys for Aggressive Chewers Dog Rope Pet Tug Toy Cotton Rope Dog Chew Toys for Large Dogs Tug...,pet supplies,Dog supplies,https://m.media-amazon.com/images/I/61LjD-wFeiL._AC_UL320_.jpg,https://www.amazon.in/DDS-Aggressive-Teething-Training-Interactive/dp/B08SK6H945/ref=sr_1_7065?qid=1679214892&s=pet-supplies&sr=1-7065,4.2,22,₹284.05,₹599
FLAWISH Pet Dog Supplies Dog Ear Care Tools Ear Stand Up Sticker for Large Dogs,pet supplies,Dog supplies,https://m.media-amazon.com/images/I/51DgC9QCf6L._AC_UL320_.jpg,https://www.amazon.in/FLAWISH-Supplies-Tools-Stand-Sticker/dp/B08B5DPS33/ref=sr_1_7066?qid=1679214892&s=pet-supplies&sr=1-7066,,,"₹1,232","₹2,466"
"FUREVER FRIENDS Stainless Steel Dog Bowl with Rubber Base for Small/Medium/Large Dogs, Pets Feeder Bowl and Water Bowl Per...",pet supplies,Dog supplies,https://m.media-amazon.com/images/I/41wJZn2PqLL._AC_UL320_.jpg,https://www.amazon.in/FUREVER-FRIENDS-Stainless-Rubber-Perfect/dp/B0B6PGNBCJ/ref=sr_1_7067?qid=1679214892&s=pet-supplies&sr=1-7067,4.1,5,₹260,₹999
"PET360 100% Pure Oceanic Fish Oil with Omega 3, EPA & DHA for Dogs & Cats 200 ml",pet supplies,Dog supplies,https://m.media-amazon.com/images/I/71w-09QBYaL._AC_UL320_.jpg,https://www.amazon.in/PET360-100-Pure-Oceanic-Omega/dp/B0BXJ9QG7N/ref=sr_1_7068?qid=1679214892&s=pet-supplies&sr=1-7068,,,₹399,₹450
Woofy Pressed Dog Bone 8 inches (Large) - Pack of 3 Bones,pet supplies,Dog supplies,https://m.media-amazon.com/images/I/51uiB1fU9HL._AC_UL320_.jpg,https://www.amazon.in/Woofy-Pressed-Bone-inches-Large/dp/B09J2CVSVG/ref=sr_1_7069?qid=1679214892&s=pet-supplies&sr=1-7069,4.0,1,₹249,₹899
Pawwfect® Dog Milk Biscuits Combo Offer 2KG (1KG+1KG),pet supplies,Dog supplies,https://m.media-amazon.com/images/I/718r1STdBYL._AC_UL320_.jpg,https://www.amazon.in/Pawwfect%C2%AE-Milk-Biscuits-Combo-Offer/dp/B08WJ7KTR1/ref=sr_1_7070?qid=1679214892&s=pet-supplies&sr=1-7070,4.5,31,₹399,₹699
"That Dog In Tuxedo Superman Dog Body Harness with Air Mesh (Red, Size M)",pet supplies,Dog supplies,https://m.media-amazon.com/images/I/71ErhKuNQLL._AC_UL320_.jpg,https://www.amazon.in/That-Dog-Tuxedo-Banana-Harness/dp/B07G2F78QG/ref=sr_1_7071?qid=1679214892&s=pet-supplies&sr=1-7071,4.5,3,"₹1,399","₹1,799"
Kapoor petsDog Belt Combo of Dog Collar with Dog Leash Specially for Small Breeds Dog Collar Leash (Yellow) Size 0.75,pet supplies,Dog supplies,https://m.media-amazon.com/images/I/31Lf4nj0RkL._AC_UL320_.jpg,https://www.amazon.in/Kapoor-petsDog-Collar-Specially-Breeds/dp/B0B1X3SBKC/ref=sr_1_7072?qid=1679214892&s=pet-supplies&sr=1-7072,4.0,2,₹94,₹299
