name,main_category,sub_category,image,link,ratings,no_of_ratings,discount_price,actual_price
Universal Hub (Pack of 5 9 Watts B22d MCPCB LED Bulb Raw Material (White),home & kitchen,Indoor Lighting,https://m.media-amazon.com/images/I/7134tcI5m1L._AC_UL320_.jpg,https://www.amazon.in/Universal-Hub-Watts-MCPCB-Material/dp/B09VDT7S93/ref=sr_1_1612_mod_primary_new?qid=1679213977&s=kitchen&sbo=RZvfv%2F%2FHxDF%2BO5021pAnSA%3D%3D&sr=1-1612,3.5,10,₹75,₹289
"LazyHomez Down Wine Glass Shape Metal Pendant Hanging Light Lamp (Vintage Black, Bulb Not Included , Pack of 4 )",home & kitchen,Indoor Lighting,https://m.media-amazon.com/images/I/41sbYPBEOKL._AC_UL320_.jpg,https://www.amazon.in/LazyHomez-Down-Shape-Pack-Included/dp/B08RC6S14R/ref=sr_1_1613?qid=1679213977&s=kitchen&sr=1-1613,3.9,310,₹949,"₹1,599"
"Foziq Traditional Terracotta Table Lamp for Home Decoration Items, Bed Side Table Lamp for Bedroom Decoration Items, Night...",home & kitchen,Indoor Lighting,https://m.media-amazon.com/images/I/51Yr6ARXEvL._AC_UL320_.jpg,https://www.amazon.in/Beige-Cotton-Terracotta-Table-Lamp/dp/B07YB38ZY9/ref=sr_1_1614?qid=1679213977&s=kitchen&sr=1-1614,4.1,3,₹819,"₹2,999"
"wipro Garnet Base E27 4-Watt LED Bulb (Pack of 3, Yellow)",home & kitchen,Indoor Lighting,https://m.media-amazon.com/images/I/41kUmZ4e2iL._AC_UL320_.jpg,https://www.amazon.in/Wipro-Garnet-Base-4-Watt-Yellow/dp/B0785VT5WG/ref=sr_1_1615?qid=1679213977&s=kitchen&sr=1-1615,4.1,264,₹507,₹750
RealBuy LED Search Light 15W with 4000 mAh Lithium-ION Battery (Range UP to 1 KM.) Water-Proof Super Bright Rechargeable H...,home & kitchen,Indoor Lighting,https://m.media-amazon.com/images/I/71IbMXrjjpL._AC_UL320_.jpg,https://www.amazon.in/REALBUY-Lithium-Water-Proof-Rechargeable-Handheld/dp/B083M6SCDP/ref=sr_1_1616?qid=1679213977&s=kitchen&sr=1-1616,3.9,49,"₹5,387","₹8,000"
IKEA Svallet Work Lamp,home & kitchen,Indoor Lighting,https://m.media-amazon.com/images/I/41I9Xa9ul5L._AC_UL320_.jpg,https://www.amazon.in/Ikea-LLC2022-IKEA-503-584-93-Svallet/dp/B09VKXR48D/ref=sr_1_1617?qid=1679213977&s=kitchen&sr=1-1617,4.3,12,₹768,"₹1,300"
"Quick Sense(QS-301) : 220 V Auto Day/Night On & Off Photocell, LDR Sensor Switch (6 A) for Lighting/Warranty:18 Months (Wa...",home & kitchen,Indoor Lighting,https://m.media-amazon.com/images/I/61GFXK+JQ7L._AC_UL320_.jpg,https://www.amazon.in/QUICK-SENSE-QS-301-Photocell-Sensor/dp/B07BPNLQ92/ref=sr_1_1618?qid=1679213977&s=kitchen&sr=1-1618,4.1,368,₹850,"₹4,500"
"DMAK Multi Traders 50 Watt Automatic Sensor System Led Street Light For Outdoor Purposes, Color-White (Pack Of 1, 50 Wat...",home & kitchen,Indoor Lighting,https://m.media-amazon.com/images/I/61FYw30zU-L._AC_UL320_.jpg,https://www.amazon.in/DMak-Automatic-Sensor-Street-Color-White/dp/B092M2RZ81/ref=sr_1_1619?qid=1679213977&s=kitchen&sr=1-1619,3.6,48,"₹1,550","₹2,460"
JTSN Mini USB Rechargeable Torch Light Super Bright Pocket Flashlight | Zoom COB USB Charging Torch Led Flashlight Water P...,home & kitchen,Indoor Lighting,https://m.media-amazon.com/images/I/514UDYCA+zL._AC_UL320_.jpg,https://www.amazon.in/JTSN-Rechargeable-Waterproof-Super-Bright/dp/B0B42XKMQ1/ref=sr_1_1620?qid=1679213977&s=kitchen&sr=1-1620,,,₹395,₹998
"ENJOY the celebration people LED Marquee Letter Lights Light Up Marquee Alphabet for Decoration, Wedding Decoration Item, ...",home & kitchen,Indoor Lighting,https://m.media-amazon.com/images/I/610rF++uhRL._AC_UL320_.jpg,https://www.amazon.in/Marquee-Alphabet-Decoratrion-Birthday-Alphabet/dp/B09MS7NBDX/ref=sr_1_1621?qid=1679213977&s=kitchen&sr=1-1621,4.2,23,₹289,"₹1,499"
Groeien LED 12 watt Modern Outdoor Acrylic Wall lamp Decorative Garden Light Up and Down Light Waterproof Outdoor Light (S...,home & kitchen,Indoor Lighting,https://m.media-amazon.com/images/I/41-xf3FEIHL._AC_UL320_.jpg,https://www.amazon.in/Groeien-Decorative-Up-Down-Waterproof/dp/B09PKCGQX4/ref=sr_1_1622?qid=1679213977&s=kitchen&sr=1-1622,3.8,25,₹899,"₹2,999"
SP WS2811 Addressable RGB LED String Lights Waterproof 12mm (DC5V 50pcs),home & kitchen,Indoor Lighting,https://m.media-amazon.com/images/I/41XP95NNGzL._AC_UL320_.jpg,https://www.amazon.in/WS2811-Addressable-String-Lights-Waterproof/dp/B0BDFNKVD1/ref=sr_1_1623?qid=1679213977&s=kitchen&sr=1-1623,5.0,1,₹499,₹999
"Lyse Decor 3 Lights Linear Aluminum Hanging Pendant Ceiling Lights Lamp-40watts, Black",home & kitchen,Indoor Lighting,https://m.media-amazon.com/images/I/611dm89jCKL._AC_UL320_.jpg,https://www.amazon.in/BrightLyts-Aluminium-Hanging-Pendant-Inch_Linear/dp/B07MKGZ2QK/ref=sr_1_1624?qid=1679213977&s=kitchen&sr=1-1624,3.9,253,"₹1,149","₹3,000"
Jackal Wall Sconce Antique Wine Bottle Lamp | Vintage Style Wall Mount Light Fixture (Pack of 2) metal,home & kitchen,Indoor Lighting,https://m.media-amazon.com/images/I/81ZazgfjYfL._AC_UL320_.jpg,https://www.amazon.in/Jackal-Sconce-Antique-Vintage-Fixture/dp/B0BFG11SDN/ref=sr_1_1625?qid=1679213977&s=kitchen&sr=1-1625,5.0,5,"₹1,069","₹2,799"
"HOMEBLAZE Light fixtures for Living Room Vintage Lamps Fancy Wall Mounted (Diamond, Black, Bulb not Included)(Iron)",home & kitchen,Indoor Lighting,https://m.media-amazon.com/images/I/615Rl+nWx3L._AC_UL320_.jpg,https://www.amazon.in/HOMEBLAZE-Vintage-Industrial-Diamond-Included/dp/B09WX6426F/ref=sr_1_1626?qid=1679213977&s=kitchen&sr=1-1626,3.9,47,₹294,"₹1,499"
"PHILIPS B22D Gls Incandescent Bulb (60 W) - Clear, Pack Of 4",home & kitchen,Indoor Lighting,https://m.media-amazon.com/images/I/31j526MHX+L._AC_UL320_.jpg,https://www.amazon.in/Philips-Clear-Incandescent-Bulb-Pack/dp/B01M0D6O3W/ref=sr_1_1627?qid=1679213977&s=kitchen&sr=1-1627,4.0,158,₹205,₹249
D'Mak 15 Watt Square Ceiling Panel White LED Light for POP/False Ceiling - Pack of 4,home & kitchen,Indoor Lighting,https://m.media-amazon.com/images/I/418ifyRUNJL._AC_UL320_.jpg,https://www.amazon.in/DMakTM-Square-Ceiling-Warranty-Lights/dp/B01MYGBA1J/ref=sr_1_1628?qid=1679213977&s=kitchen&sr=1-1628,3.8,142,"₹1,275","₹1,800"
Diktmark Beautiful Hanging Light Love Bird Cage Vintage Edison Rope Ceiling Hanging Pendant Lights Lamp for Cafe Restauran...,home & kitchen,Indoor Lighting,https://m.media-amazon.com/images/I/51tE9gIoo6L._AC_UL320_.jpg,https://www.amazon.in/Diktmark-Love-Bird-Restaurant-Decorative/dp/B0BK1YR3NZ/ref=sr_1_1629?qid=1679213977&s=kitchen&sr=1-1629,5.0,2,₹739,"₹1,599"
"SYSKA 9W B22 Led White Bulb, Pack Of 20(B22D)",home & kitchen,Indoor Lighting,https://m.media-amazon.com/images/I/81b42QY34BL._AC_UL320_.jpg,https://www.amazon.in/SYSKA-SSK-SRL-9W-Base-9-Watt-Unbreakable-White/dp/B083ZZGB9K/ref=sr_1_1630?qid=1679213977&s=kitchen&sr=1-1630,3.9,255,"₹1,490","₹7,180"
Murphy 50W Led Waterproof With Auto On/Off Day Night Light Sensor Flood Light : Pack Of 1(Aluminium),home & kitchen,Indoor Lighting,https://m.media-amazon.com/images/I/61LSa+WtjfL._AC_UL320_.jpg,https://www.amazon.in/Murphy-Waterproof-Night-Light-Sensor/dp/B09QYM4CHG/ref=sr_1_1631?qid=1679213977&s=kitchen&sr=1-1631,3.8,63,"₹1,650","₹2,890"
"ADEPT Sturdy Adjustable Lightweight Eye-Care Easy Clip-on COB LED Book Reading Lamp Flexible Arm for Bookworms and Kids, c...",home & kitchen,Indoor Lighting,https://m.media-amazon.com/images/I/515rYgdzwPL._AC_UL320_.jpg,https://www.amazon.in/BSITFOW-Adjustable-Flexible-Lightweight-Bookworms/dp/B08LKHXY33/ref=sr_1_1632?qid=1679213977&s=kitchen&sr=1-1632,4.0,36,₹353,₹399
"Mufasa 220V AC LED Neon Light, 8MM Thick Pipe Neon Rope Light Waterproof Indoor Outdoor Decoration Light Flexible Light Wi...",home & kitchen,Indoor Lighting,https://m.media-amazon.com/images/I/61Dq5+SWHYL._AC_UL320_.jpg,https://www.amazon.in/Mufasa-Waterproof-Connector-Christmas-Decoration/dp/B08VMP46VF/ref=sr_1_1681?qid=1679213979&s=kitchen&sr=1-1681,4.0,174,₹379,₹499
"SYSKA Ssk-Srl-5W-2 Base B22 5-Watt Led Bulb (Pack Of 2, White, Cool Day Light, B22D)",home & kitchen,Indoor Lighting,https://m.media-amazon.com/images/I/516kwl5vwAL._AC_UL320_.jpg,https://www.amazon.in/Syska-Base-5-Watt-Bulb-Light/dp/B01DNPUHFQ/ref=sr_1_1682?qid=1679213979&s=kitchen&sr=1-1682,4.1,"2,805",₹219,₹298
"Limbjal® 4 in 1 Colors Sunset Lamp, Sunset Projection Lamp Led Night Lights, 360 Degree Rotation Height Adjustable Romanti...",home & kitchen,Indoor Lighting,https://m.media-amazon.com/images/I/61213yBXhwL._AC_UL320_.jpg,https://www.amazon.in/Limbjal%C2%AE-Projection-Adjustable-Projector-Multicolour/dp/B0BD9C8PTD/ref=sr_1_1683?qid=1679213979&s=kitchen&sr=1-1683,5.0,2,₹389,₹999
"JERN Smart Control Sensor Led Night Light Bedroom Lamp With Dual Usb Phone Charging Switch Socket (Warm White, Pack Of 1,P...",home & kitchen,Indoor Lighting,https://m.media-amazon.com/images/I/51job+rYiDL._AC_UL320_.jpg,https://www.amazon.in/JERN-Night-Sensor-Charging-Socket/dp/B079L7RWT3/ref=sr_1_1684?qid=1679213979&s=kitchen&sr=1-1684,3.9,302,₹679,"₹1,000"
PHILIPS Ace Saver 5 Watt B22D LED Bulb | Crystal White LED Bulb | Pack of 1,home & kitchen,Indoor Lighting,https://m.media-amazon.com/images/I/51qwsTrULML._AC_UL320_.jpg,https://www.amazon.in/Philips-Saver-Watt-Crystal-White/dp/B0B1Q1DNCT/ref=sr_1_1685?qid=1679213979&s=kitchen&sr=1-1685,4.4,140,₹116.55,₹135
"Kuber Industries Star Shape String Lights|6 Big and 6 Small Window Decoration Lights|String Fairy Lights for Christmas,Wed...",home & kitchen,Indoor Lighting,https://m.media-amazon.com/images/I/713Ykmsf4wL._AC_UL320_.jpg,https://www.amazon.in/Kuber-Industries-Decoration-Christmas-Wedding/dp/B0BG2VVXKM/ref=sr_1_1686?qid=1679213979&s=kitchen&sr=1-1686,4.8,14,,₹499
Improvhome E27 Holder Base Traditional Mounted Vintage Natural Rustic Rope Jute Type Hanging Pendant Ceiling Light Lamp Sc...,home & kitchen,Indoor Lighting,https://m.media-amazon.com/images/I/41su8NUOw4L._AC_UL320_.jpg,https://www.amazon.in/Improvhome-Traditional-Mounted-Decoration-Included/dp/B08P4RDTBG/ref=sr_1_1687?qid=1679213979&s=kitchen&sr=1-1687,3.9,44,₹580,₹990
MAGIK Savio LED Rechargable Emergency Lamp 9W 6500K B22 Inverter Cool Day White Bulb for home (Pack of 1),home & kitchen,Indoor Lighting,https://m.media-amazon.com/images/I/71M6tZBWChL._AC_UL320_.jpg,https://www.amazon.in/MAGIK-Savio-Rechargable-Emergency-Inverter/dp/B0BLNPQMZ8/ref=sr_1_1688?qid=1679213979&s=kitchen&sr=1-1688,5.0,4,₹330,₹380
"SBE (7219) 1 Inch X 8 Feet Length Golden Chrome Stainless Steel Mirror Strip PVD Coated for Decoration, Furniture, Highlig...",home & kitchen,Indoor Lighting,https://m.media-amazon.com/images/I/4189hOqVVOL._AC_UL320_.jpg,https://www.amazon.in/Stainless-Decoration-Furniture-Highlighters-Multiple/dp/B0BB7LYBXJ/ref=sr_1_1689?qid=1679213979&s=kitchen&sr=1-1689,3.5,16,₹469,₹999
wipro Garnet N70002 B22 7-Watt LED Bulb (Warm White/Golden Yellow) -Pack of 2,home & kitchen,Indoor Lighting,https://m.media-amazon.com/images/I/61AvVUsrsZL._AC_UL320_.jpg,https://www.amazon.in/Wipro-Garnet-N70002-7-Watt-Golden/dp/B0191EQSWE/ref=sr_1_1690?qid=1679213979&s=kitchen&sr=1-1690,4.3,101,₹200,₹450
"CITRA Led Vintage Edison Bulbs,Antique Retro Incandescent Light Bulb 4W Squirrel Cage Filament Light Bulb T45 Classic Ambe...",home & kitchen,Indoor Lighting,https://m.media-amazon.com/images/I/41V6j4u035L._AC_UL320_.jpg,https://www.amazon.in/Vintage-Incandescent-Squirrel-Filament-Dimmable/dp/B081XDFLGY/ref=sr_1_1691?qid=1679213979&s=kitchen&sr=1-1691,4.3,31,₹379,₹999
"Vk Lampshade Industry, Lamp Shade, Home Decor Antique Finish Taper Transparent Lampshade for Table Lamp (10x8x8 Inches) La...",home & kitchen,Indoor Lighting,https://m.media-amazon.com/images/I/71fsfvSfiXL._AC_UL320_.jpg,https://www.amazon.in/Lampshade-Industry-Transparent-suitable-Decoration/dp/B09963NQF6/ref=sr_1_1692?qid=1679213979&s=kitchen&sr=1-1692,4.5,28,₹469,₹750
"FRESTYQUE Star Master Rotating 360 Degree Moon Night Light Lamp Projector with Colors and USB Cable,Lamp for Kids Room Nig...",home & kitchen,Indoor Lighting,https://m.media-amazon.com/images/I/51nczPOJ1NL._AC_UL320_.jpg,https://www.amazon.in/FRESTYQUE-Master-Rotating-Degree-Projector/dp/B099NPJWMG/ref=sr_1_1693?qid=1679213979&s=kitchen&sr=1-1693,3.5,45,₹499,₹699
tu casa Ntu-272 Off White Cotton Shade Floor lamp with Wood Base Holder type--b-22 (Bulb not Included),home & kitchen,Indoor Lighting,https://m.media-amazon.com/images/I/81-ptvp--AL._AC_UL320_.jpg,https://www.amazon.in/casa-Ntu-272-Cotton-type-b-22-Included/dp/B08D41PCDT/ref=sr_1_1694?qid=1679213979&s=kitchen&sr=1-1694,4.4,8,"₹1,049.50","₹4,999"
"SKP Automation Systems 18/8 Steel Industrial Emergency Light , (White)-Battery Powered",home & kitchen,Indoor Lighting,https://m.media-amazon.com/images/I/413MBhOsr6S._AC_UL320_.jpg,https://www.amazon.in/SKP-Automation-Systems-Automatic-Security/dp/B07CP59Z29/ref=sr_1_1695?qid=1679213979&s=kitchen&sr=1-1695,4.7,16,"₹3,400","₹4,800"
"Mufasa 4-Watts B22 Base LED Edison Vintage Antique Glass Light Bulbs for Home Decoration, Living Room, Hall, Balcony, Rest...",home & kitchen,Indoor Lighting,https://m.media-amazon.com/images/I/51CFiDQZhEL._AC_UL320_.jpg,https://www.amazon.in/Mufasa-Convertor-Tungsten-Squirrel-Filament/dp/B07TVYV4YD/ref=sr_1_1696?qid=1679213979&s=kitchen&sr=1-1696,4.2,101,₹525,₹999
"Baisun Led Par Stage Light with 3W X 54 RGB (3 in 1) Led for Use in DJ Disco Party, Stage Lighting, Wedding and Festive De...",home & kitchen,Indoor Lighting,https://m.media-amazon.com/images/I/81ygvn-YBTL._AC_UL320_.jpg,https://www.amazon.in/Baisun-Lighting-Wedding-Festive-Decorations/dp/B081LFWQK2/ref=sr_1_1697?qid=1679213979&s=kitchen&sr=1-1697,1.9,2,"₹2,499","₹6,999"
Mr Antique Premium Italian Floor Lamp Standing Modern Black 5ft Height Off White Lamp Shade 12 inches Drum Shade for Livin...,home & kitchen,Indoor Lighting,https://m.media-amazon.com/images/I/712tA9EnBlL._AC_UL320_.jpg,https://www.amazon.in/Antique-Premium-Italian-Standing-Modern/dp/B0BSR2CV9F/ref=sr_1_1698?qid=1679213979&s=kitchen&sr=1-1698,5.0,1,"₹1,698","₹2,899"
RFS USB Light - Portable Compact Night Plug-in Mini LED Bulb Night Light Ideal for Bedroom Bathroom Nursery Hallway Kitche...,home & kitchen,Indoor Lighting,https://m.media-amazon.com/images/I/31bK+K43vaL._AC_UL320_.jpg,https://www.amazon.in/RFS-USB-Light-Plug-Atmosphere/dp/B0BCVTB469/ref=sr_1_1699?qid=1679213979&s=kitchen&sr=1-1699,4.0,147,₹74,₹299
gradians LED Oval Shape Outdoor Indoor Bulkhead Waterproof IP54 Wall Lamp 9 Watts Garden Outdoor Light- [16 X 6.5 X 4.5 c...,home & kitchen,Indoor Lighting,https://m.media-amazon.com/images/I/91Jawz3Fg-L._AC_UL320_.jpg,https://www.amazon.in/gradians-Outdoor-Bulkhead-Waterproof-cm_Cool/dp/B0BLHSQ4C7/ref=sr_1_1700?qid=1679213979&s=kitchen&sr=1-1700,4.0,2,₹199,₹799
"Amazon Brand - Solimo String Lights with USB-Operated, 5m (Warm White)",home & kitchen,Indoor Lighting,https://m.media-amazon.com/images/I/71q6u1L1VuL._AC_UL320_.jpg,https://www.amazon.in/Amazon-Brand-Solimo-String-USB-Operated/dp/B0BB74RFWW/ref=sr_1_1701?qid=1679213979&s=kitchen&sr=1-1701,2.5,2,₹112,₹399
"VERVENIX Milky Ball String Lights 42 Led 12 Meter Goti String Fairy Light For Decoration Light, Plug-In (Warm White, Pack ...",home & kitchen,Indoor Lighting,https://m.media-amazon.com/images/I/41v-scR3BqL._AC_UL320_.jpg,https://www.amazon.in/VERVENIX-Ball-String-Light-Decoration/dp/B0B94JCQDN/ref=sr_1_1702?qid=1679213979&s=kitchen&sr=1-1702,3.6,284,₹379,₹999
"PHILIPS Ace Saver 2.7W E27 LED Glass Candle Bulb | Candle Bulb for Home Decoration | Warm White, Pack of 1",home & kitchen,Indoor Lighting,https://m.media-amazon.com/images/I/51JnDCPyd9L._AC_UL320_.jpg,https://www.amazon.in/Philips-Saver-Glass-Candle-Decoration/dp/B0B2RGT5LD/ref=sr_1_1703?qid=1679213979&s=kitchen&sr=1-1703,,,₹116.55,₹130
"Groeien Wall Rotating 12Watts 360 Degree Adjustable Led Round Sun Moon Eclipse Wall Light For Bedroom,Dining- Warm White (...",home & kitchen,Indoor Lighting,https://m.media-amazon.com/images/I/31mSVwGsHhL._AC_UL320_.jpg,https://www.amazon.in/Groeien-Rotating-12Watts-360-Adjustable/dp/B09PG1KT94/ref=sr_1_1704?qid=1679213979&s=kitchen&sr=1-1704,3.9,19,"₹1,350","₹2,999"
MAGBHA Fancy Color Changing Mushroom LED Night Light with Sensor (Small 11 * 5 Size) (1),home & kitchen,Indoor Lighting,https://m.media-amazon.com/images/I/41XihnPp0YL._AC_UL320_.jpg,https://www.amazon.in/MAGBHA-Fancy-Changing-Mushroom-Sensor/dp/B0BSR1KJ9X/ref=sr_1_1825?qid=1679213982&s=kitchen&sr=1-1825,5.0,1,₹139,₹699
"Murphy 7W B22D BEE 3 Star Rated LED Golden Yellow (Warm White) Bulb, Pack of 2 (GLO)",home & kitchen,Indoor Lighting,https://m.media-amazon.com/images/I/71TgTkH1bUL._AC_UL320_.jpg,https://www.amazon.in/Murphy-Base-7-Watt-Bulb-White/dp/B07W4WCQX7/ref=sr_1_1826?qid=1679213982&s=kitchen&sr=1-1826,4.3,92,₹240,₹280
"PHILIPS 18W B22 LED Emergency Inverter Bulb (Crystal White, Pack of 1)",home & kitchen,Indoor Lighting,https://m.media-amazon.com/images/I/61LkjFAOEQL._AC_UL320_.jpg,https://www.amazon.in/Philips-Emergency-Inverter-Crystal-White/dp/B09NNHB7D3/ref=sr_1_1827?qid=1679213982&s=kitchen&sr=1-1827,3.4,56,₹748,₹999
"QSHIXLE Solar Wall Lights Small Fence Lights Solar Powered, Up Down LED Porch Light, Luces Solares para Exteriores, Outdoo...",home & kitchen,Indoor Lighting,https://m.media-amazon.com/images/I/51eK5iV-d0L._AC_UL320_.jpg,https://www.amazon.in/QSHIXLE-Powered-Solares-Exteriores-Exterior/dp/B0BDFYWVYN/ref=sr_1_1828?qid=1679213982&s=kitchen&sr=1-1828,4.1,70,₹479,"₹1,499"
"Murphy 20W LED Cool White Tube Light, Pack of 1",home & kitchen,Indoor Lighting,https://m.media-amazon.com/images/I/41ZfEud1K0L._AC_UL320_.jpg,https://www.amazon.in/Murphy-Light-Cool-White-Batten/dp/B07TSBVJ2T/ref=sr_1_1829?qid=1679213982&s=kitchen&sr=1-1829,4.2,236,₹575,₹825
"Luxurious 50W Circular Wooden Wall Hanging Lamp for Bedroom, Living Room (AC,Brown)",home & kitchen,Indoor Lighting,https://m.media-amazon.com/images/I/31OdPAXmzVL._AC_UL320_.jpg,https://www.amazon.in/Luxurious-Wooden-Hanging-Bedroom-Living/dp/B08RJV74HB/ref=sr_1_1830?qid=1679213982&s=kitchen&sr=1-1830,3.3,12,₹355,₹999
"NOVALUC 16 LED Blossom Flower Fairy String Lights, 3 Meters LED Christmas Lights for Diwali Home Decoration (Warm White)",home & kitchen,Indoor Lighting,https://m.media-amazon.com/images/I/71KWCQoNXkL._AC_UL320_.jpg,https://www.amazon.in/NOVALUC-Blossom-Flower-Christmas-Decoration/dp/B08JQLDLM4/ref=sr_1_1831?qid=1679213982&s=kitchen&sr=1-1831,4.2,953,₹240,₹599
"SYSKA SSK-SRL-12W-Base B22 12-Watt Unbreakable,25000 Hr Life Span LED Bulb (Pack of 4, Cool Day Light)",home & kitchen,Indoor Lighting,https://m.media-amazon.com/images/I/71mWmJTNh0L._AC_UL320_.jpg,https://www.amazon.in/SYSKA-SSK-SRL-12W-Base-12-Watt-Unbreakable-25000/dp/B09MCR7CQ2/ref=sr_1_1832?qid=1679213982&s=kitchen&sr=1-1832,3.6,14,₹669,"₹1,716"
"GreyWings Round Hanging Light Shade, White (Without Bulb,Aluminium) - Pack of 4",home & kitchen,Indoor Lighting,https://m.media-amazon.com/images/I/41dGLzJbN5L._AC_UL320_.jpg,https://www.amazon.in/GreyWings-Pendant-Ceiling-Restaurant-provided/dp/B086X389P1/ref=sr_1_1833?qid=1679213982&s=kitchen&sr=1-1833,4.0,66,"₹1,099","₹1,999"
"Vivid 36w LED Street Light (Lens Model) with 2 Years Warranty, for Outdoor Use",home & kitchen,Indoor Lighting,https://m.media-amazon.com/images/I/61ySlORqIeL._AC_UL320_.jpg,https://www.amazon.in/Vivid-LED-Street-Warranty-Outdoor/dp/B0B4JHKYBZ/ref=sr_1_1834?qid=1679213982&s=kitchen&sr=1-1834,3.8,46,₹789,"₹2,500"
"D’Mak 3 Watt Warm White LED COB or Spot Ceiling Light for False Ceiling, Aluminium Metal Powder Coated, Bright LED Light w...",home & kitchen,Indoor Lighting,https://m.media-amazon.com/images/I/61PpoxSOV0L._AC_UL320_.jpg,https://www.amazon.in/Button-Square-Driver-Included-Decoration/dp/B078Y5GB7C/ref=sr_1_1835?qid=1679213982&s=kitchen&sr=1-1835,4.1,96,₹760,"₹1,750"
JUBILEE TRADERS Decorative Antique Design Pendant Wall LAMP- CLEAR,home & kitchen,Indoor Lighting,https://m.media-amazon.com/images/I/41O6eounzQL._AC_UL320_.jpg,https://www.amazon.in/JUBILEE-TRADERS-Decorative-Antique-Pendant/dp/B07XP452KV/ref=sr_1_1836?qid=1679213982&s=kitchen&sr=1-1836,3.7,42,₹409,"₹1,259"
PIXORA Modern Up Down Outdoor and Indoor LED Wall Lamp Waterproof IP65 12W Warm White,home & kitchen,Indoor Lighting,https://m.media-amazon.com/images/I/51bQ7Lzr45L._AC_UL320_.jpg,https://www.amazon.in/PIXORA-Modern-Outdoor-Indoor-Waterproof/dp/B0B82W4LJ4/ref=sr_1_1837?qid=1679213982&s=kitchen&sr=1-1837,4.6,8,₹627,"₹1,299"
Halonix 10 Watt_Hours B22D Led Cool Day Light Motion Sensor Bulb,home & kitchen,Indoor Lighting,https://m.media-amazon.com/images/I/61oU3fU087S._AC_UL320_.jpg,https://www.amazon.in/Halonix-watt_hours-Light-Motion-Sensor/dp/B08RWHYTKV/ref=sr_1_1838?qid=1679213982&s=kitchen&sr=1-1838,3.9,819,₹347,₹349
Electronicspices High Power LED Chip Warm White Super Bright Intensity COB Light Emitter Components Diode 3W Bulb Lamp Bea...,home & kitchen,Indoor Lighting,https://m.media-amazon.com/images/I/61QVMi-nOVL._AC_UL320_.jpg,https://www.amazon.in/Electronicspices-Intensity-Emitter-Components-Lighting/dp/B084ZPZYBK/ref=sr_1_1839?qid=1679213982&s=kitchen&sr=1-1839,3.1,8,₹86,₹89
"2.4 Volt-1900 MAH High Capacity Rechargeable Battery for Britelite Torch,Rechargeable Battery for Torch Light (2.4 Volt-19...",home & kitchen,Indoor Lighting,https://m.media-amazon.com/images/I/41Gr+bvuNgL._AC_UL320_.jpg,https://www.amazon.in/Volt-1900-Capacity-Rechargeable-Battery-Britelite/dp/B0B9SSJWNZ/ref=sr_1_1840?qid=1679213982&s=kitchen&sr=1-1840,2.9,6,₹399,₹599
"Homenique 9 Watt Waterproof Outdoor LED Bulkhead IP65 Wall or Ceiling Light (Warm White,plastic)",home & kitchen,Indoor Lighting,https://m.media-amazon.com/images/I/31-dtMUg-3L._AC_UL320_.jpg,https://www.amazon.in/Homenique-Waterproof-Outdoor-Bulkhead-Location/dp/B097LR8BQC/ref=sr_1_1841?qid=1679213982&s=kitchen&sr=1-1841,3.2,311,₹225,₹450
"Deco Home Torch Fuel Citronella , 5 L",home & kitchen,Indoor Lighting,https://m.media-amazon.com/images/I/41uJ6KNbAwL._AC_UL320_.jpg,https://www.amazon.in/Deco-Home-Torch-Fuel-Citronella/dp/B01COSBOK0/ref=sr_1_1842?qid=1679213982&s=kitchen&sr=1-1842,3.8,30,,"₹2,499"
kinis 6 Light Tree Cutting Design Jhoomer/Chandelier/Jhoomer Hanging Light/Jhoomer Ceiling Light to Décor Home/Living Roo...,home & kitchen,Indoor Lighting,https://m.media-amazon.com/images/I/61H9C-rG4lL._AC_UL320_.jpg,https://www.amazon.in/kinis-Cutting-Jhoomer-Chandelier-Restaurants/dp/B0B84W5T78/ref=sr_1_1843?qid=1679213982&s=kitchen&sr=1-1843,,,"₹3,699","₹6,238"
"Jaquar Lighting LED Kriza 9-Watt Emergency Bulb, 6500K (700 Lumen, Cool White), JQM-WHT-LKRZ009B22CW",home & kitchen,Indoor Lighting,https://m.media-amazon.com/images/I/61gQCNNATCL._AC_UL320_.jpg,https://www.amazon.in/Jaquar-Lighting-9-Watt-Emergency-JQM-WHT-LKRZ009B22CW/dp/B09PGDC982/ref=sr_1_1844_mod_primary_new?qid=1679213982&s=kitchen&sbo=RZvfv%2F%2FHxDF%2BO5021pAnSA%3D%3D&sr=1-1844,5.0,2,₹390,₹580
KILSON 50w Led Driver for Street Light & Flood Light 300mA Silver,home & kitchen,Indoor Lighting,https://m.media-amazon.com/images/I/81zTVqTI3TL._AC_UL320_.jpg,https://www.amazon.in/KILSON-Driver-Street-Light-Silver/dp/B0BTCV92NT/ref=sr_1_1845?qid=1679213982&s=kitchen&sr=1-1845,,,₹299,₹499
"SYSKA SSK-T103AA LED Torch , Strong ABS Material Body, Zinc Carbon Batteries (Yellow)",home & kitchen,Indoor Lighting,https://m.media-amazon.com/images/I/61SltgBtpzL._AC_UL320_.jpg,https://www.amazon.in/SYSKA-SSK-T103AA-Strong-Material-Batteries/dp/B08X2TPLV4/ref=sr_1_1846?qid=1679213982&s=kitchen&sr=1-1846,3.4,11,₹115,₹299
Smart led light 36watt LED Street Light Outdoor Industrial Light - Pack of 1(Metal),home & kitchen,Indoor Lighting,https://m.media-amazon.com/images/I/61X-3GOk2bL._AC_UL320_.jpg,https://www.amazon.in/Smart-led-light-Light-White/dp/B0899LKNPS/ref=sr_1_1847?qid=1679213982&s=kitchen&sr=1-1847,3.7,62,₹649,"₹1,200"
"spareworld Fridge Bulb, Compatible with Whirlpool and Samsung Refrigerator (Transparent, Set of 4)",home & kitchen,Indoor Lighting,https://m.media-amazon.com/images/I/516afbGSK3L._AC_UL320_.jpg,https://www.amazon.in/Spareworld-Compatible-Whirlpool-Samsung-Refrigerator/dp/B085XKCWDF/ref=sr_1_1848?qid=1679213982&s=kitchen&sr=1-1848,3.9,140,₹280,₹400
"Homesake Wall Light, Wall Lamp Wood Light for Home Decoration, Chandelier Home, Living Room, Indoor Outdoor Jhumar, Wall H...",home & kitchen,Indoor Lighting,https://m.media-amazon.com/images/I/516afbGSK3L._AC_UL320_.jpg,https://www.amazon.in/HomesakeTM-Edison-Vintage-Industrial-Decorative/dp/B07Q74YXVK/ref=sr_1_1849?qid=1679213983&s=kitchen&sr=1-1849,3.7,43,"₹1,055","₹2,400"
OVERSEAS MART Nautical Spotlight Floor Lamp Tripod Stand Hollywood Floor Lamp for Living Room Bedroom Conner Lamp Nautical...,home & kitchen,Indoor Lighting,https://m.media-amazon.com/images/I/71ehtz9TB-L._AC_UL320_.jpg,https://www.amazon.in/OverseasMart-Aluminium-Wooden-Spotlight-Decorative/dp/B081DS1ZXT/ref=sr_1_2233?qid=1679213989&s=kitchen&sr=1-2233,3.8,109,"₹1,757.44","₹2,999"
"PHILIPS Joy Vision Coral Rush 0.5-Watt LED Bulb (White) - Pack of 4, B22D",home & kitchen,Indoor Lighting,https://m.media-amazon.com/images/I/41lZOlZ0i3L._AC_UL320_.jpg,https://www.amazon.in/Philips-Vision-Coral-0-5-Watt-White/dp/B00OBSKEZS/ref=sr_1_2234?qid=1679213989&s=kitchen&sr=1-2234,4.4,395,₹372,₹600
"SVH® Sunset Lamp with Remote Control - 16 Colors/4 Modes UFO Shape Rainbow Projection Night Light, 180 Degree Rotation USB...",home & kitchen,Indoor Lighting,https://m.media-amazon.com/images/I/51JG2WttUXL._AC_UL320_.jpg,https://www.amazon.in/SVH%C2%AE-Sunset-Lamp-Remote-Control/dp/B0BRSG9X96/ref=sr_1_2235?qid=1679213989&s=kitchen&sr=1-2235,,,₹699,₹999
"DHVANTH™ LED Lights Outdoor Waterproof 50 W Wall Mount Street Light with IP65 Driver, Metal Body (Sm) (Light Color: White)",home & kitchen,Indoor Lighting,https://m.media-amazon.com/images/I/71lK-oaialL._AC_UL320_.jpg,https://www.amazon.in/SUN-LED-LIGHTS-Outdoor-Waterproof/dp/B09779J95B/ref=sr_1_2236?qid=1679213989&s=kitchen&sr=1-2236,3.6,25,₹695,"₹1,499"
