name,main_category,sub_category,image,link,ratings,no_of_ratings,discount_price,actual_price
"Homesake Hanging Pendant Ceiling Light, Multicolour, Diamond Shaped, 60 Watts , Metal ,Corded Electric",home & kitchen,Indoor Lighting,https://m.media-amazon.com/images/I/91hkGbgPbwL._AC_UL320_.jpg,https://www.amazon.in/Homesake%C2%AE-Hanging-Golden-Steel-Pendant/dp/B083R8RSC9/ref=sr_1_6345?qid=1679214056&s=kitchen&sr=1-6345,4.6,38,₹949,"₹2,500"
"wipro Tejas Base B22D 7-Watt LED Bulb (Pack of 6, Cool Day Light)",home & kitchen,Indoor Lighting,https://m.media-amazon.com/images/I/71g9n6-UB2L._AC_UL320_.jpg,https://www.amazon.in/Wipro-Tejas-Base-7-Watt-Light/dp/B01M7WPBVE/ref=sr_1_6346?qid=1679214056&s=kitchen&sr=1-6346,4.1,39,₹588,₹960
"Tabletop Bonsai Tree Light with 36 Pearls LED, 20"" Good Luck Plant, DIY Artificial Lamp Tree Lamp Decoration, Battery/USB ...",home & kitchen,Indoor Lighting,https://m.media-amazon.com/images/I/51UCpYajK2L._AC_UL320_.jpg,https://www.amazon.in/Tabletop-Bonsai-Tree-Artificial-Decoration/dp/B0BGZTKX6B/ref=sr_1_6347?qid=1679214056&s=kitchen&sr=1-6347,4.0,5,₹700,"₹2,500"
"BRITSPEAR Night Lights 7 Color Changing Plug-in Light Sensor Wall Lamp, LED Mushroom Night Lights Sensor Dusk to Dawn Sens...",home & kitchen,Indoor Lighting,https://m.media-amazon.com/images/I/51jpUMLTXqL._AC_UL320_.jpg,https://www.amazon.in/BRITSPEAR-Lights-Changing-Sensor-Mushroom/dp/B09VC2S1D5/ref=sr_1_6348?qid=1679214056&s=kitchen&sr=1-6348,5.0,1,₹170,₹499
"Skyepic Crackle Glass Pattern Vision 0.3-Watts LED Bulb Night Lamp with Switch (Navy Blue, Only Lamp Light)",home & kitchen,Indoor Lighting,https://m.media-amazon.com/images/I/81aypatBHaL._AC_UL320_.jpg,https://www.amazon.in/SKYEPIC-Crackle-Pattern-Vision-0-3-Watts/dp/B09N7Q7TSF/ref=sr_1_6349?qid=1679214056&s=kitchen&sr=1-6349,3.7,4,₹349,₹599
SANDED EDGE - SMARTLY PRICED Sanded Edge - Smartly d Plaza Uplight Floor Lamp With 2 Shelf For Decorative Of 6 Inch Dia An...,home & kitchen,Indoor Lighting,https://m.media-amazon.com/images/I/71-KMkEqDTS._AC_UL320_.jpg,https://www.amazon.in/SANDED-EDGE-SMARTLY-Uplight-Decorative/dp/B098XD1VS3/ref=sr_1_6350?qid=1679214056&s=kitchen&sr=1-6350,4.1,78,"₹2,400","₹4,000"
"D'Mak 22 Watt LED Round False Ceiling/ Recessed Panel Light for POP (warm white (Yellow), Pack of 10)",home & kitchen,Indoor Lighting,https://m.media-amazon.com/images/I/5138-yCGKYL._AC_UL320_.jpg,https://www.amazon.in/DMak-Round-Ceiling-Recessed-Yellow/dp/B082XX4HDR/ref=sr_1_6351?qid=1679214056&s=kitchen&sr=1-6351,4.5,6,"₹3,640","₹5,800"
Memoxy Torch Lights Rechargeable Led Flashlight with Cob Light Mini Waterproof Portable Led Xpe Cob Flashlight USB Recharg...,home & kitchen,Indoor Lighting,https://m.media-amazon.com/images/I/61YM4ARQy9L._AC_UL320_.jpg,https://www.amazon.in/Memoxy-Rechargeable-Flashlight-Waterproof-Portable/dp/B0BS9F8MVY/ref=sr_1_6352?qid=1679214056&s=kitchen&sr=1-6352,5.0,1,₹199,₹698
CRAFTSDEC E27 40-Watts Aluminium Metallic 10 inch Dome Pendant Light for Ceiling|Pack of 1|Copper-White|Hanging Decorative...,home & kitchen,Indoor Lighting,https://m.media-amazon.com/images/I/61Q+GXXe7SL._AC_UL320_.jpg,https://www.amazon.in/CRAFTSDEC-40-Watts-Aluminium-Copper-White-Decorative/dp/B0B31JCXP6/ref=sr_1_6353?qid=1679214056&s=kitchen&sr=1-6353,5.0,1,₹499,₹998
Gifts n Gallery Personalized Couple Name Wedding Gift Lamp Best lamp Best Frame Gifted Frame (Design-3),home & kitchen,Indoor Lighting,https://m.media-amazon.com/images/I/71ZP9fwVMyL._AC_UL320_.jpg,https://www.amazon.in/Gifts-Gallery-Wedding-Couples-Wooden/dp/B09VSV5L37/ref=sr_1_6354?qid=1679214056&s=kitchen&sr=1-6354,3.8,108,₹749,"₹1,799"
ZSQUAREHP Uplight Antique Bronze Wall Lamp Multicolor 26x15,home & kitchen,Indoor Lighting,https://m.media-amazon.com/images/I/81G9jAS5jWL._AC_UL320_.jpg,https://www.amazon.in/ZSQUAREHP-Uplight-Antique-Bronze-Multicolor/dp/B09DVGPJGY/ref=sr_1_6355?qid=1679214056&s=kitchen&sr=1-6355,,,₹585,"₹1,138"
"DARKROOM Light Wooden Base LED Modern Standing Floor Lamp (White Shade, Black, Pack of 1)",home & kitchen,Indoor Lighting,https://m.media-amazon.com/images/I/212UWxkRqxL._AC_UL320_.jpg,https://www.amazon.in/DARKROOM-Light-Wooden-Modern-Standing/dp/B097H9KW63/ref=sr_1_6356?qid=1679214056&s=kitchen&sr=1-6356,3.9,154,"₹1,299","₹3,500"
"Cardio Lights 60 Watts Hanging Light With Bulb, Brown, Oval-Bamboo(Dc)",home & kitchen,Indoor Lighting,https://m.media-amazon.com/images/I/51bchF-joZL._AC_UL320_.jpg,https://www.amazon.in/Bamboo-Hanging-Amazing-Quality-Height/dp/B08GJYPMZL/ref=sr_1_6357?qid=1679214056&s=kitchen&sr=1-6357,3.4,36,"₹1,198","₹4,999"
"D'Mak 10W LED Green 2 Foot Green Tubelight, Pack of 2",home & kitchen,Indoor Lighting,https://m.media-amazon.com/images/I/61SQKqJTCyL._AC_UL320_.jpg,https://www.amazon.in/DMakTM-Watt-Green-Tublight-Decoration/dp/B07TZJTTWX/ref=sr_1_6358?qid=1679214056&s=kitchen&sr=1-6358,4.6,3,₹830,"₹1,800"
"Panasonic Base B22 40-Watt LED Bulb (Pack of 1, Cool Day Light)",home & kitchen,Indoor Lighting,https://m.media-amazon.com/images/I/51NySJkXkhL._AC_UL320_.jpg,https://www.amazon.in/Panasonic-Base-40-Watt-Bulb-Light/dp/B086XT6H69/ref=sr_1_6359_mod_primary_new?qid=1679214056&s=kitchen&sbo=RZvfv%2F%2FHxDF%2BO5021pAnSA%3D%3D&sr=1-6359,4.4,5,₹689,₹999
"Prop It Up 30712 4 Watts Round Wall Light, Black , Metal",home & kitchen,Indoor Lighting,https://m.media-amazon.com/images/I/61IJxy8eflL._AC_UL320_.jpg,https://www.amazon.in/Prop-Up-Industrial-Personality-American/dp/B084ZRVF99/ref=sr_1_6360?qid=1679214056&s=kitchen&sr=1-6360,4.0,67,₹403,₹999
"DIONA Acrylic Saibaba Shirdi 3D LED Night Lamp, Home Decor, 7 Colour Changing Lights Small Portable Decorative Divine Wall...",home & kitchen,Indoor Lighting,https://m.media-amazon.com/images/I/610kgVNIx7L._AC_UL320_.jpg,https://www.amazon.in/DIONA-Saibaba-Shirdi-Corporate-Decorative/dp/B08L9QMH27/ref=sr_1_6625?qid=1679214060&s=kitchen&sr=1-6625,4.3,23,₹189,₹249
"kinis Double Doom at 180 Degree Wall Light/Wall Lamp to Décor Home/Living Room/Bedroom/Office/Dining/Cafe/Restaurants, Gold",home & kitchen,Indoor Lighting,https://m.media-amazon.com/images/I/41QlPFJ+uZL._AC_UL320_.jpg,https://www.amazon.in/Double-Degree-Living-Bedroom-Restaurants/dp/B0B3DJBT8H/ref=sr_1_6626?qid=1679214060&s=kitchen&sr=1-6626,5.0,1,₹799,"₹1,974"
One94Store LED Marquee Letter Lights Sign; Light Up Alphabet Letters for Wedding Birthday Party Christmas Home Bar Decorat...,home & kitchen,Indoor Lighting,https://m.media-amazon.com/images/I/51IACuRevnL._AC_UL320_.jpg,https://www.amazon.in/One94store-Marquee-Lights-Christmas-Decoration/dp/B09QGRX2B4/ref=sr_1_6627?qid=1679214060&s=kitchen&sr=1-6627,4.4,68,₹289,₹999
WHITERAY Wooden Traditional 5 Watt LED Wall Light(Set of 2),home & kitchen,Indoor Lighting,https://m.media-amazon.com/images/I/91nMR+I6zyL._AC_UL320_.jpg,https://www.amazon.in/WhiteRay-S43-5-Watt-Light-Brown/dp/B06Y18CXMX/ref=sr_1_6628?qid=1679214060&s=kitchen&sr=1-6628,3.3,13,₹499,"₹1,000"
Lite Up Wooden Tripod Floor Lamp with Jute Shade,home & kitchen,Indoor Lighting,https://m.media-amazon.com/images/I/51Yyx-MAheL._AC_UL320_.jpg,https://www.amazon.in/Lite-Wooden-Tripod-Floor-Shade/dp/B0BWMRCXSJ/ref=sr_1_6629?qid=1679214060&s=kitchen&sr=1-6629,,,"₹1,200","₹5,000"
Light4life Set of-1 Gate Garden Outdoor Waterproof Mega Pillar Lamp/gate Light for Home gate/gate Lights for Outdoor,home & kitchen,Indoor Lighting,https://m.media-amazon.com/images/I/51a178j19CL._AC_UL320_.jpg,https://www.amazon.in/Light4life-Gate-Outdoor-Waterproof-Light/dp/B0BVG633WS/ref=sr_1_6630?qid=1679214060&s=kitchen&sr=1-6630,1.0,1,"₹1,399","₹3,000"
Care 4 Metal Alluminium Waterproof Body Rubber Covering On The Head and Handle High Power Lazer Light with Long Range Good...,home & kitchen,Indoor Lighting,https://m.media-amazon.com/images/I/613NnJbTlLL._AC_UL320_.jpg,https://www.amazon.in/Care-Alluminium-Waterproof-Covering-Brightness/dp/B09GPBVJ28/ref=sr_1_6631?qid=1679214060&s=kitchen&sr=1-6631,5.0,1,"₹1,499","₹2,199"
"Branzios Plastic Bed Light Lamp, Multicolour, Pack of 1",home & kitchen,Indoor Lighting,https://m.media-amazon.com/images/I/51tl+0MvLjL._AC_UL320_.jpg,https://www.amazon.in/Branzios-Plastic-Light-Lamp-Multicolour/dp/B0927KCFD2/ref=sr_1_6632?qid=1679214060&s=kitchen&sr=1-6632,3.8,28,₹499,₹999
ONECYA ROYAL FANCY Modern Uplight Antique Bronze Wall Lamp Light with Attractive Glass Shade,home & kitchen,Indoor Lighting,https://m.media-amazon.com/images/I/81yvEpFjmQL._AC_UL320_.jpg,https://www.amazon.in/ONECYA-ROYAL-FANCY-Uplight-Attractive/dp/B0BQS148G7/ref=sr_1_6633?qid=1679214060&s=kitchen&sr=1-6633,,,₹439,"₹1,099"
Homesake B018 Edison Vintage Rope Hanging Ceiling Light (Beige) -Set of 2(corded electric),home & kitchen,Indoor Lighting,https://m.media-amazon.com/images/I/71hW2CD78ZL._AC_UL320_.jpg,https://www.amazon.in/Homesake%C2%AE-Edison-Vintage-Hanging-Ceiling/dp/B07YFM6P2S/ref=sr_1_6634?qid=1679214060&s=kitchen&sr=1-6634,3.5,18,₹406,"₹1,600"
Aeiza |104| Macrame Lamp Shade Boho Hanging Pendant Light Cover Modern Office Bedroom Living Room Nursery Dorm Room Bohemi...,home & kitchen,Indoor Lighting,https://m.media-amazon.com/images/I/613vltJqJoL._AC_UL320_.jpg,https://www.amazon.in/Aeiza-104-Macrame-Hanging-Bohemian/dp/B0BG6GZVJ8/ref=sr_1_6635?qid=1679214060&s=kitchen&sr=1-6635,1.0,1,₹999,"₹1,999"
"Bright Electronics Garden LED Light, 5w, Light Color-Blue Waterproof with 2 Year Warranty, Pack of 2",home & kitchen,Indoor Lighting,https://m.media-amazon.com/images/I/61BAC9WHH7L._AC_UL320_.jpg,https://www.amazon.in/Bright-Electronics-Color-Blue-Waterproof-Warranty/dp/B08RR4C2Z7/ref=sr_1_6636?qid=1679214060&s=kitchen&sr=1-6636,3.9,6,₹705,"₹1,400"
"EasyDelite Metal 6 Inch Dome Antique Hanging Pendant Light for Ceiling, Single Hanging Decorative Lamp for Living Room, Re...",home & kitchen,Indoor Lighting,https://m.media-amazon.com/images/I/41IZXrJbfyL._AC_UL320_.jpg,https://www.amazon.in/EasyDelite-Antique-Hanging-Decorative-Restaurant/dp/B0BF4NK6DC/ref=sr_1_6637?qid=1679214060&s=kitchen&sr=1-6637,4.0,2,₹849,"₹3,356"
Empire Electrotech B22 1W Color Bulb Pack of 2 (Blue),home & kitchen,Indoor Lighting,https://m.media-amazon.com/images/I/51YOTPD79gL._AC_UL320_.jpg,https://www.amazon.in/Empire-Electrotech-Color-Bulb-Blue/dp/B09QMH7GX5/ref=sr_1_6638?qid=1679214060&s=kitchen&sr=1-6638,2.0,2,₹160,₹220
Goroly 5 watt White DOB (Driver on Board) MCPCB Raw Material of LED Bulb | Pack of 20 Pcs.,home & kitchen,Indoor Lighting,https://m.media-amazon.com/images/I/517OZZP+paL._AC_UL320_.jpg,https://www.amazon.in/GorolyTM-White-Driver-Board-Material/dp/B09161HRK2/ref=sr_1_6639?qid=1679214060&s=kitchen&sr=1-6639,3.5,12,₹349,₹999
"SPARC LIGHTS ® 5 Watts Triangular Wall Light ( Red, Green, Blue, Yellow )",home & kitchen,Indoor Lighting,https://m.media-amazon.com/images/I/51MlIGmsQWL._AC_UL320_.jpg,https://www.amazon.in/SPARC-LIGHTS%C2%AE-Triangular-Metalic-Warranty/dp/B08HJP55CY/ref=sr_1_6640?qid=1679214060&s=kitchen&sr=1-6640,3.4,25,₹835,"₹1,999"
"Homesake Hanging Pendant Ceiling Light, Multicolour, Diamond Shaped, 60 Watts , Metal ,Corded Electric",home & kitchen,Indoor Lighting,https://m.media-amazon.com/images/I/91hkGbgPbwL._AC_UL320_.jpg,https://www.amazon.in/Homesake%C2%AE-Hanging-Golden-Steel-Pendant/dp/B083R8RSC9/ref=sr_1_6641?qid=1679214060&s=kitchen&sr=1-6641,4.6,38,₹949,"₹2,500"
EarthenMetal Handcrafted Glass Decorated Surahi Shaped Hanging Light (Multicolour),home & kitchen,Indoor Lighting,https://m.media-amazon.com/images/I/81MK2RHvZTL._AC_UL320_.jpg,https://www.amazon.in/Earthenmetal-Handcrafted-Decorated-Surahi-Hanging/dp/B075VSWKHV/ref=sr_1_6642?qid=1679214060&s=kitchen&sr=1-6642,,,₹820,"₹14,500"
AXY 18650 Nickel Strip H-Type Thickness 0.12 Width 27mm Nickel Plated 2P roll for Lithium ion Battery Pack Making. (3 Meter),home & kitchen,Indoor Lighting,https://m.media-amazon.com/images/I/51wd1IQ3edL._AC_UL320_.jpg,https://www.amazon.in/AXY-18650-Nickel-Thickness-Lithium/dp/B0BQHRQBP9/ref=sr_1_6643?qid=1679214060&s=kitchen&sr=1-6643,,,₹350,₹800
RONFILD 3D 7 Color Changing Moon Light with Stand for Bedroom Lights for Adults and Kids Home Room Beautiful Moon Lamp for...,home & kitchen,Indoor Lighting,https://m.media-amazon.com/images/I/61Xxh6eQuvL._AC_UL320_.jpg,https://www.amazon.in/RONFILD-Changing-Bedroom-Beautiful-Lighting/dp/B098L575W7/ref=sr_1_6644?qid=1679214060&s=kitchen&sr=1-6644,4.3,10,₹599,"₹1,599"
"Hoshila172 LED Solar Emergency Light Bulb Lantern, USB Mobile Charging, Travel Camping Lantern Black",home & kitchen,Indoor Lighting,https://m.media-amazon.com/images/I/6102q5ufxsL._AC_UL320_.jpg,https://www.amazon.in/Hoshila172-Emergency-Lantern-Charging-Camping/dp/B07TCXGQN9/ref=sr_1_6645?qid=1679214060&s=kitchen&sr=1-6645,,,₹299,₹519
LiteMart LED Outdoor Exterior Wall Step Up Down Light Fixture Lamp (Warm White),home & kitchen,Indoor Lighting,https://m.media-amazon.com/images/I/71z3sJU4kYL._AC_UL320_.jpg,https://www.amazon.in/LiteMart-Outdoor-Exterior-Light-Fixture/dp/B0B6HPZ5WZ/ref=sr_1_6646?qid=1679214060&s=kitchen&sr=1-6646,,,₹594,"₹1,499"
CITRA 24W Led Bathroom Vanity Picture Mirror 4 Light Black Gold Wall Lamp - Warm White,home & kitchen,Indoor Lighting,https://m.media-amazon.com/images/I/41Pz-+uBhuL._AC_UL320_.jpg,https://www.amazon.in/Citra-Bathroom-Vanity-Picture-Mirror/dp/B09PC65S6F/ref=sr_1_6647?qid=1679214060&s=kitchen&sr=1-6647,4.0,2,"₹5,499","₹5,999"
"Vivid 24w LED Street Light for Outdoor Use, IP65, with Two Years Warranty, Waterproof, with Wall Mounted Clamp",home & kitchen,Indoor Lighting,https://m.media-amazon.com/images/I/51PHy6SBIoL._AC_UL320_.jpg,https://www.amazon.in/LED-Outdoor-Warranty-Waterproof-Mounted/dp/B08Q35YTXQ/ref=sr_1_6648?qid=1679214060&s=kitchen&sr=1-6648,4.0,85,₹679,"₹1,999"
"Urban Sajavaat Table Lamp Night Cordless Portable Rechargeable, 3 Way Modes & Dimmable LED Touch Lamp Metal Indoor Gold Me...",home & kitchen,Indoor Lighting,https://m.media-amazon.com/images/I/71HXj6VbUuL._AC_UL320_.jpg,https://www.amazon.in/Urban-Sajavaat-Cordless-Rechargeable-Restaurant/dp/B0BTJ1RSJ8/ref=sr_1_6817?qid=1679214063&s=kitchen&sr=1-6817,Get,Only 1 left in stock.,"₹1,488","₹1,999"
"Ikea Not Floor Uplighter Led Bulb , Black (Height: 1.75 M (69"") Base Diameter: 0.26 M (10"") Shade Diameter: 0.28 M (11"") C...",home & kitchen,Indoor Lighting,https://m.media-amazon.com/images/I/21+gK26fk3L._AC_UL320_.jpg,https://www.amazon.in/Ikea-Floor-uplighter-Black-Height/dp/B07SHV49QP/ref=sr_1_6818?qid=1679214063&s=kitchen&sr=1-6818,4.6,30,"₹2,150","₹3,299"
"Homesake® Edison Wall Black Guard Cone Shade Lamp, Vintage Industrial Loft, E27 Holder, Decorative,Swing Wall Light (Nickel)",home & kitchen,Indoor Lighting,https://m.media-amazon.com/images/I/81kPTjxmEdL._AC_UL320_.jpg,https://www.amazon.in/HomesakeTM-Edison-Vintage-Industrial-Decorative/dp/B07RQXN1XN/ref=sr_1_6819?qid=1679214063&s=kitchen&sr=1-6819,3.3,11,"₹1,199","₹2,500"
D'Mak Round Surface LED Panel Surface 22 Watt Ceiling Light with IC Driver Energy Saver IP50 Dust Proof (White) - Pack of 12,home & kitchen,Indoor Lighting,https://m.media-amazon.com/images/I/51eX60UL3PL._AC_UL320_.jpg,https://www.amazon.in/DMakTM-Surface-Lights-Ceiling-Required/dp/B07L1HRNBP/ref=sr_1_6820?qid=1679214063&s=kitchen&sr=1-6820,3.9,15,"₹4,340","₹8,640"
NEXT GEEK Cool White 1 Watt SMD LED Chip Diode Bulb Lamp (PACK OF 10),home & kitchen,Indoor Lighting,https://m.media-amazon.com/images/I/51oITwSURSL._AC_UL320_.jpg,https://www.amazon.in/Nextgeek-Cool-White-Watt-Diode/dp/B07FXWCB4R/ref=sr_1_6821?qid=1679214063&s=kitchen&sr=1-6821,3.8,7,₹120,₹220
"HP SOUND PLUS® Brite LITE Aircraft Aluminium Alloy LED 1900 M Rechargeable Flashlight Torch, Cool Daylight, Pack",home & kitchen,Indoor Lighting,https://m.media-amazon.com/images/I/41FNU-Ig4SL._AC_UL320_.jpg,https://www.amazon.in/HP-SOUND-Aluminium-Rechargeable-Flashlight/dp/B09VZL3FVX/ref=sr_1_6822?qid=1679214063&s=kitchen&sr=1-6822,4.0,2,"₹2,199","₹3,500"
"AYMH® Sloped Light, Metal Modern Hanging Lamp for Living Room, E26/27 Nordic Pendant Lights for Ceiling, Kitchen, Bedroom,...",home & kitchen,Indoor Lighting,https://m.media-amazon.com/images/I/61YHWjJmg3L._AC_UL320_.jpg,https://www.amazon.in/Hanging-Pendant-Ceiling-Decorative-Included/dp/B09SF7B46M/ref=sr_1_6823?qid=1679214063&s=kitchen&sr=1-6823,,,₹499,"₹1,999"
"UKANI 7 Colour Changing 3D Illusion Design Islamic Panjatan Design Night Lamp (Multicolour, 3 Inch)",home & kitchen,Indoor Lighting,https://m.media-amazon.com/images/I/61xVD5bN2EL._AC_UL320_.jpg,https://www.amazon.in/UKANI-Changing-Illusion-Panjatan-Multicolour/dp/B092DJ85SM/ref=sr_1_6824?qid=1679214063&s=kitchen&sr=1-6824,4.3,8,₹229,₹399
"Gadget Hero's Pocket LED Mini CREE XR-E Q5 UltraFire Flashlight Torch Adjustable Zoom Beam. Black with 3 Flash Mode. 7W, 4...",home & kitchen,Indoor Lighting,https://m.media-amazon.com/images/I/61VMgHpQdRL._AC_UL320_.jpg,https://www.amazon.in/Gadget-Heros-Q5-7-Watt-Torch/dp/B00TKA7IRE/ref=sr_1_6825?qid=1679214063&s=kitchen&sr=1-6825,3.5,122,₹401,₹601
"MULTY RAYS Modern Waterproof Unbreakable Outdoor gate/Garden/Pillar/Park Light Without Bulb, B22 (Pack of 1) Medium",home & kitchen,Indoor Lighting,https://m.media-amazon.com/images/I/41E8Y-L2q3S._AC_UL320_.jpg,https://www.amazon.in/MULTY-RAYS-Waterproof-Unbreakable-Outdoor/dp/B0BBMQQHJR/ref=sr_1_6826?qid=1679214063&s=kitchen&sr=1-6826,4.5,2,₹399,₹999
YKXIMS SK Trades Headlamp Multifunction Pocket Carry LED Head Light Bicycle Camping Tracking Head Torch Light led Head lamp,home & kitchen,Indoor Lighting,https://m.media-amazon.com/images/I/41TZFBKTYoL._AC_UL320_.jpg,https://www.amazon.in/YKXIMS-Headlamp-Multifunction-Bicycle-Tracking/dp/B0BVZC19DS/ref=sr_1_6827?qid=1679214063&s=kitchen&sr=1-6827,,,₹189,₹999
"SYSKA Fab-4001 Fan Shaped Base B22 40-Watt Led Bulb (Pack Of 2, White,B22D)",home & kitchen,Indoor Lighting,https://m.media-amazon.com/images/I/61+PnrpymfL._AC_UL320_.jpg,https://www.amazon.in/Syska-FAB-4001-Shaped-40-Watt-White/dp/B07P56FD8P/ref=sr_1_6828?qid=1679214063&s=kitchen&sr=1-6828,3.7,58,"₹1,245","₹1,598"
"PHILIPS StellarBright 12-Watt LED Bulb B22 Base ( Crystal White, Pack of 2 )",home & kitchen,Indoor Lighting,https://m.media-amazon.com/images/I/41N8jL1IIkL._AC_UL320_.jpg,https://www.amazon.in/Philips-Base-12-Watt-Bulb-Light/dp/B016W0ZY8O/ref=sr_1_6829_mod_primary_new?qid=1679214063&s=kitchen&sbo=RZvfv%2F%2FHxDF%2BO5021pAnSA%3D%3D&sr=1-6829,4.1,856,₹432,₹560
Homes Elite Outdoor Pole Gate Light Main Door Entrance Pillar Lamp Outside Post Path House Entry Modern Unbreakable Stainl...,home & kitchen,Indoor Lighting,https://m.media-amazon.com/images/I/41I6L-tdz2L._AC_UL320_.jpg,https://www.amazon.in/HomesElite-Entrance-Decorative-Exterior-Lighting/dp/B09J3Q55SZ/ref=sr_1_6830?qid=1679214063&s=kitchen&sr=1-6830,3.1,3,₹899,"₹2,000"
"GREEVA Aluminium 7 Mode Rechargeable Solar LED Torch Flashlight, Power Bank, Car Emergency Tool with Window Breaker, Magne...",home & kitchen,Indoor Lighting,https://m.media-amazon.com/images/I/61IswjgxomL._AC_UL320_.jpg,https://www.amazon.in/GREEVA-Aluminium-Rechargeable-Flashlight-Emergency/dp/B092322SS6/ref=sr_1_6831?qid=1679214063&s=kitchen&sr=1-6831,5.0,3,"₹1,288","₹1,999"
A.N.C Brass Antique 3 Bulb Mid Century Modern Wall Sconce Vanity Light (Gold)-Ac,home & kitchen,Indoor Lighting,https://m.media-amazon.com/images/I/71yeiJvyM3L._AC_UL320_.jpg,https://www.amazon.in/N-C-Antique-Century-Bathroom-Lighting/dp/B08S43WTCS/ref=sr_1_6832?qid=1679214063&s=kitchen&sr=1-6832,4.4,8,"₹1,749","₹3,900"
"rpl led bulb 9w dob bulb white pack off10 9W स्टैंडर्ड बग लाइट बल्ब (सफेद, 10 का पैक)",home & kitchen,Indoor Lighting,https://m.media-amazon.com/images/I/51pSBeVBGHL._AC_UL320_.jpg,https://www.amazon.in/bulb-white-pack-off10-%E0%A4%B8%E0%A5%8D%E0%A4%9F%E0%A5%88%E0%A4%82%E0%A4%A1%E0%A4%B0%E0%A5%8D%E0%A4%A1/dp/B0BS1LRW31/ref=sr_1_6833?qid=1679214063&s=kitchen&sr=1-6833,,,₹299,₹599
VOFFY Indoor Outdoor String Lights 50 Meter Decoration Lights 200 LED's Bulb Light Waterproof Home Decoration Fairy Lights...,home & kitchen,Indoor Lighting,https://m.media-amazon.com/images/I/61c-wOu4MRL._AC_UL320_.jpg,https://www.amazon.in/Indoor-Outdoor-Decoration-Waterproof-Festival/dp/B09HCHFZR6/ref=sr_1_6834?qid=1679214063&s=kitchen&sr=1-6834,3.4,20,₹599,"₹1,299"
"24 Watt LED Street Light PCB and Driver (White Light Colour), 13.1*7*0.15 cm",home & kitchen,Indoor Lighting,https://m.media-amazon.com/images/I/617sTHnWNQL._AC_UL320_.jpg,https://www.amazon.in/Street-Light-Driver-White-Colour/dp/B09DBDD35F/ref=sr_1_6835?qid=1679214063&s=kitchen&sr=1-6835,3.8,17,₹439,₹999
wipro Garnet 20W Round LED Wave Panel | Cool White Light (6000K) | Ultra-Slim Design | Recessed Down Light for False Ceili...,home & kitchen,Indoor Lighting,https://m.media-amazon.com/images/I/71OOi2VdK7L._AC_UL320_.jpg,https://www.amazon.in/Wipro-D712060-Garnet-20-Watt-Panel/dp/B077K4RD49/ref=sr_1_6836?qid=1679214063&s=kitchen&sr=1-6836,3.9,24,₹987,"₹1,400"
"Decorativehut Crystal Chandelier for Living Room, Home and Office Lights Decoration (Pack of 1)",home & kitchen,Indoor Lighting,https://m.media-amazon.com/images/I/91loNqEgpaL._AC_UL320_.jpg,https://www.amazon.in/Decorativehut-Crystal-Chandelier-Living-Decoration/dp/B0BRWCXJ1M/ref=sr_1_6837?qid=1679214063&s=kitchen&sr=1-6837,4.0,1,₹899,"₹2,999"
"LTZ 12 Stars Led Curtain String Lights Window Curtain Lights with 8 Flashing Modes Decoration for Wedding Party, Outdoor H...",home & kitchen,Indoor Lighting,https://m.media-amazon.com/images/I/41uOFH+Ti-L._AC_UL320_.jpg,https://www.amazon.in/Curtain-Flashing-Decoration-Wedding-Christmas/dp/B0BLC8YXPQ/ref=sr_1_6838?qid=1679214063&s=kitchen&sr=1-6838,3.3,3,₹699,"₹1,999"
"GAUVIK 6 Light LX Down Jhoomar/Chandelier for Restaurant,Bedroom,Living Room,Home Decor Chandelier Ceiling Lamp.Brown and ...",home & kitchen,Indoor Lighting,https://m.media-amazon.com/images/I/61H9C-rG4lL._AC_UL320_.jpg,https://www.amazon.in/GAUVIK-LX-Down-Jhoomar-Chandelier/dp/B0B1F324R4/ref=sr_1_6839?qid=1679214063&s=kitchen&sr=1-6839,3.7,4,"₹3,699","₹7,278"
"Carsten Crystal Maded Hanging Light/Pendant Light/Ceiling Light for Decor Home, Round Crystal, Silver and Clear ,Corded El...",home & kitchen,Indoor Lighting,https://m.media-amazon.com/images/I/41zsV7PTYIL._AC_UL320_.jpg,https://www.amazon.in/Carsten-Crystal-Hanging-Pendant-Restaurants/dp/B0B1CLBLR6/ref=sr_1_6840?qid=1679214063&s=kitchen&sr=1-6840,5.0,2,₹622,"₹1,350"
CITRA 250 MM Brown Body Triangle Ceiling lamp LED Pendant Hanging Lamp - Warm White,home & kitchen,Indoor Lighting,https://m.media-amazon.com/images/I/51sgTYvBIlL._AC_UL320_.jpg,https://www.amazon.in/CITRA-Triangle-Ceiling-Pendant-Hanging/dp/B08K54J7NK/ref=sr_1_6913?qid=1679214065&s=kitchen&sr=1-6913,4.1,27,"₹2,999","₹9,999"
"PHILIPS 20W LED Cool White Batten Led Tubelight, Pack of 1, (919515813970_1)",home & kitchen,Indoor Lighting,https://m.media-amazon.com/images/I/71Mf90ao4aL._AC_UL320_.jpg,https://www.amazon.in/Philips-TwinGlow-20-Watt-Up-Down-Tubelight/dp/B085P2J19P/ref=sr_1_6914?qid=1679214065&s=kitchen&sr=1-6914,4.1,293,"₹1,408","₹1,499"
"Halonix Star CW LPF Candle Base E14 5-Watt LED Bulb (Pack of 2, White)",home & kitchen,Indoor Lighting,https://m.media-amazon.com/images/I/71-FZ+xctKL._AC_UL320_.jpg,https://www.amazon.in/Halonix-Star-CW-LPF-Candle/dp/B07D8DP4H4/ref=sr_1_6915?qid=1679214065&s=kitchen&sr=1-6915,5.0,1,₹399,₹499
VRCT Halogen Tube Holder 500-watt Glass Halogen Lamp Double-Ended Porcelain Halogen Socket - 118mm - R7s Base(Size: 4.7-in...,home & kitchen,Indoor Lighting,https://m.media-amazon.com/images/I/311WZy4muVL._AC_UL320_.jpg,https://www.amazon.in/VRCT-Halogen-500-watt-Double-Ended-Porcelain/dp/B0BS6XRQQX/ref=sr_1_6916?qid=1679214065&s=kitchen&sr=1-6916,,,₹299,₹999
"WAH NOTION® Small Torch Light for Kids Torch Projector Beautiful,Attractive Gift Item (Pack of 4) - Multicolor",home & kitchen,Indoor Lighting,https://m.media-amazon.com/images/I/8158mJA19FL._AC_UL320_.jpg,https://www.amazon.in/NOTION%C2%AE-Small-Projector-Beautiful-Attractive/dp/B0B71R7WNN/ref=sr_1_6917?qid=1679214065&s=kitchen&sr=1-6917,,,₹158,₹443
Jenner Waterproof Floating Lotus Light Battery Operated Flower Light Pool Floating Light for Pond Water Fountain Hot tub W...,home & kitchen,Indoor Lighting,https://m.media-amazon.com/images/I/41eK0GidwbL._AC_UL320_.jpg,https://www.amazon.in/Jenner-Waterproof-Floating-Operated-Fountain/dp/B09HHN4YVZ/ref=sr_1_6918?qid=1679214065&s=kitchen&sr=1-6918,5.0,4,₹549,"₹1,099"
"ComicSense.xyz Detroit Smash Led Night Lamp - 16 Color Changing Light Desk Lamp, Anime Home Decor Light - Multicolor",home & kitchen,Indoor Lighting,https://m.media-amazon.com/images/I/71zY65sTaVL._AC_UL320_.jpg,https://www.amazon.in/Detroit-Smash-Led-Night-Lamp/dp/B09GVWQ6LR/ref=sr_1_6919?qid=1679214065&s=kitchen&sr=1-6919,5.0,1,"₹1,249","₹2,299"
"Gvnd Night Lights for Kids - Multifunctional Night Light Star Projector Lamp for Decorating Birthdays, Christmas, and Othe...",home & kitchen,Indoor Lighting,https://m.media-amazon.com/images/I/61jT10z4ulL._AC_UL320_.jpg,https://www.amazon.in/Gvnd-Night-Lights-Kids-Multifunctional/dp/B08HMQ9HKV/ref=sr_1_6920?qid=1679214065&s=kitchen&sr=1-6920,,,"₹1,999","₹3,999"
YONOTA® Attractive 0.5W Automatic Smart Sensor LED Plug Night Lamp for Bedroom Gift Office Living Room Pack 1 (Orange),home & kitchen,Indoor Lighting,https://m.media-amazon.com/images/I/41sajwMwgCL._AC_UL320_.jpg,https://www.amazon.in/YONOTA%C2%AE-Attractive-Automatic-Sensor-Bedroom/dp/B0BVBQMD5K/ref=sr_1_6921?qid=1679214065&s=kitchen&sr=1-6921,,,₹289,₹749
The Decor Kart Angel Cherub - Tiffany Lamp I,home & kitchen,Indoor Lighting,https://m.media-amazon.com/images/I/61-O96xMqEL._AC_UL320_.jpg,https://www.amazon.in/Decor-Kart-Angel-Cherub-Tiffany/dp/B0BSR3L6B3/ref=sr_1_6922?qid=1679214065&s=kitchen&sr=1-6922,Get,Only 1 left in stock.,"₹11,925","₹22,500"
